Topic,Subject,Start Date,Start Time,End Date,End Time,All Day Event,Description,Location,Private
,Writing master class: &quot;Before the Law&quot;,2015-06-05,2:30 p.m.,2015-06-05,3:30 p.m.,False,"Speakers: Jennifer Gonnerman, Stephen Engelberg - **Moderated by Stephen Engelberg, ProPublica | URL: http://ire.org/events-and-training/event/1574/1945/",Franklin 5&amp;6,False
,Get the Sqoop: An easier way to search and set alerts for public records information (Sponsored by Knight Foundation),2015-06-05,2:30 p.m.,2015-06-05,3:30 p.m.,False,Speakers: Bill Hankes | URL: http://ire.org/events-and-training/event/1574/2002/,Franklin 7,False
,Investigating the investigators: Digging into regulatory agencies,2015-06-05,2:30 p.m.,2015-06-05,3:30 p.m.,False,"Speakers: Howard Berkes, Tom Frank, Jay LaMonica, Doug Pardue - **Moderated by Jay LaMonica, Al Jazeera America | URL: http://ire.org/events-and-training/event/1574/2101/",Franklin 3&amp;4,False
,Cracking the political piggy bank: An introduction to campaign finance data (Sponsored by Rockefeller Brothers Fund),2015-06-05,2:30 p.m.,2015-06-05,3:30 p.m.,False,"Speakers: Ben Wieder - Learn how to access and analyze federal and state campaign finance data to follow the money in your community. We&rsquo;ll cover how to keep tabs on top donors to your local Congressmen and Senators, and how to track political action committees active in their races. You&rsquo;ll work with data from the Federal Election Commission and learn about other resources available for tracking influence in federal and state elections. | URL: http://ire.org/events-and-training/event/1574/2023/",Room 404,False
,Management track: Dodging the bullets - making your stories as error and libel free as possible,2015-06-05,3:40 p.m.,2015-06-05,4:40 p.m.,False,"Speakers: Fernando Diaz, Bill Marimow, Les Zaitz, Robin Fields - **Moderated by Robin Fields, ProPublica | URL: http://ire.org/events-and-training/event/1574/1969/",Salon C,False
,More with R,2015-06-05,3:40 p.m.,2015-06-05,4:40 p.m.,False,Speakers: Coulter Jones | URL: http://ire.org/events-and-training/event/1574/2018/,Room 401,False
,"Prisons, jails and punishment: The real story (Sponsored by Criminal Justice Journalists)",2015-06-05,3:40 p.m.,2015-06-05,4:40 p.m.,False,"Speakers: Julie Brown, David Rudovsky, Eileen Sullivan, Ted Gest, John Wetzel - **Moderated by Ted Gest, Criminal Justice Journalists | URL: http://ire.org/events-and-training/event/1574/1980/",Salon D,False
,Covering threats against journalists overseas without leaving town,2015-06-05,3:40 p.m.,2015-06-05,4:40 p.m.,False,"Speakers: Courtney Mabeus, Dana Priest, Kamran Shafi - This session will cover the &nbsp;methodology used to research individual journalists imprisoned overseas including the use of social media to find and interview the colleagues and families of prisoners. Both the methodology and the social media tools can be easily adapted to report on other subjects outside of the United States without leaving the country. This session, which includes the perspective of a formerly imprisoned reporter, also will address the reasons why every journalist should consider investigating issues of press freedom around the world. | URL: http://ire.org/events-and-training/event/1574/1946/",Franklin 5&amp;6,False
,Broadcast: How some of the best work gets done,2015-06-05,3:40 p.m.,2015-06-05,4:40 p.m.,False,"Speakers: Joel Grover, Brian Ross, Phil Williams - Three veteran journalists discuss how they produce solid, award-winning investigations year after year -- and keep the bosses happy. | URL: http://ire.org/events-and-training/event/1574/1958/",Franklin 9&amp;10,False
maps,Using Fusion Tables,2015-06-05,3:40 p.m.,2015-06-05,4:40 p.m.,False,"Speakers: Joe Yerardi - Did you ever have your hands on a dataset that just cried out to be displayed as a map but thought you needed to be a coding wizard to make it happen? Then come to this session to learn how to make maps using Google Fusion Tables. Fusion Tables is a free service from Google that offers journalists a point-and-click interface for quickly and easily building interactive maps that can be embedded on almost any webpage, no coding knowledge required. | URL: http://ire.org/events-and-training/event/1574/2024/",Room 404,False
,The art of developing sources,2015-06-05,3:40 p.m.,2015-06-05,4:40 p.m.,False,"Speakers: Manny Garcia, James Polk, Bernice Yeung, Matt Goldberg - **Moderated by Matt Goldberg, NBC4 Los Angeles | URL: http://ire.org/events-and-training/event/1574/1934/",Franklin 1&amp;2,False
,The anatomy of a crisis: Tracking the records trail,2015-06-05,3:40 p.m.,2015-06-05,4:40 p.m.,False,"Speakers: Danielle Ivory, Sheila MacVicar - One event can set in motion the creation of data and documents that can prove useful to reporters. In this panel, we'll follow the methodology of picking through the paper and database trails to build an investigation after a crisis. While the panel will focus on two case studies, auto recalls and oil train derailments, attendees will leave with ideas of how to seek out additional information after an event. | URL: http://ire.org/events-and-training/event/1574/2102/",Franklin 3&amp;4,False
,Show &amp; Tell (Friday - #4),2015-06-05,3:40 p.m.,2015-06-05,4:40 p.m.,False,"Speakers: Phil Drechsler - **Moderated by Phil Drechsler, NBC4 Los Angeles | URL: http://ire.org/events-and-training/event/1574/2068/",Franklin 8,False
,Stonewalled: Strategies for getting what you need out of government,2015-06-05,3:40 p.m.,2015-06-05,4:40 p.m.,False,"Speakers: Rob Barry, Walt Bogdanich, Carol Leonnig, Charles Lewis - **Moderated by Charles Lewis, Investigative Reporting Workshop | URL: http://ire.org/events-and-training/event/1574/1992/",Salon E,False
,A case study in virtual reality: Creating an Ebola documentary (Sponsored by Knight Foundation),2015-06-05,3:40 p.m.,2015-06-05,4:40 p.m.,False,"Speakers: Fergus Pitt - This session will present what&rsquo;s been learned from our prototype production: A VR documentary about the spread of ebola in West Africa; a partnership between The Tow Center For Digital Journalism at Columbia University, PBS FRONTLINE and the Secret Location interactive agency. | URL: http://ire.org/events-and-training/event/1574/1904/",Franklin 7,False
regex,Cleaning data with regular expressions and more,2015-06-05,4:45 p.m.,2015-06-05,6:00:00 p.m.,False,"Speakers: Agustin Armendariz - An introduction to regular expressions. Before any data analysis can happen, there's typically a lot of work done cleaning and getting to know the data. This class will help you add regular expressions to your toolkit. Think of regular expressions as search patterns on steroids. Instead of finding specific terms you'll learn to describe general patterns you wish to uncover. Regular expressions can be used in various places. For this class we'll use a text editor to explore the syntax of regular expressions. | URL: http://ire.org/events-and-training/event/1574/2025/",Room 404,False
,Show &amp; Tell (Friday - #5),2015-06-05,4:45 p.m.,2015-06-05,6:00:00 p.m.,False,"Speakers: Melissa Blasius-Nuanez - **Moderated by Melissa Blasius-Nuanez, KUSA/9News Denver | URL: http://ire.org/events-and-training/event/1574/2069/",Franklin 8,False
,Finding the story: Contracts,2015-06-05,4:45 p.m.,2015-06-05,6:00:00 p.m.,False,"Speakers: Danielle Ivory - Having the ability to unlock government spending can be a valuable tool for any journalist's arsenal. During this session, we will walk through the online, free websites that allow the public to access federal government contracting data, and how to track down story ideas. This session is good for anyone who has some experience working with data in Excel. | URL: http://ire.org/events-and-training/event/1574/2019/",Room 401,False
,Oil on the tracks: Covering the explosive story of crude trains (Sponsored by Society of Environmental Journalists),2015-06-05,4:50 p.m.,2015-06-05,6:00:00 p.m.,False,"Speakers: Russell Gold, Grant Robertson, Sarah Feinberg - **Moderated by Russell Gold, The Wall Street Journal | URL: http://ire.org/events-and-training/event/1574/2104/",Franklin 3&amp;4,False
,Working with whistleblowers,2015-06-05,4:50 p.m.,2015-06-05,6:00:00 p.m.,False,"Speakers: Scott Bronstein, Steve Riley, Dennis Wagner, Sarah Cohen - **Moderated by Sarah Cohen, The New York Times | URL: http://ire.org/events-and-training/event/1574/2105/",Franklin 5&amp;6,False
,Quantity and quality,2015-06-05,4:50 p.m.,2015-06-05,6:00:00 p.m.,False,"Speakers: Aaron Diamant, John Ferrugia, David Raziq | URL: http://ire.org/events-and-training/event/1574/1970/",Salon C,False
,Broadcast: Your presentation style,2015-06-05,4:50 p.m.,2015-06-05,6:00:00 p.m.,False,"Speakers: Barry Nash - The Coaching Company Founder and Head Coach, Barry Nash, will talk about the challenge of addressing an audience you can neither see nor hear, the subtle and not-so-subtle ways it can compromise your message, and what to do about it. &nbsp;He&rsquo;ll share related research and load you up with practical tips on how to dress, move and talk so that viewers are more likely to &ldquo;get&rdquo; your stories, and your stories are more likely to get the attention they deserve. | URL: http://ire.org/events-and-training/event/1574/1960/",Franklin 9&amp;10,False
,Digital presentation for investigations,2015-06-05,4:50 p.m.,2015-06-05,6:00:00 p.m.,False,"Speakers: Paul Cheung, Benjamin Herold, Giannina Segnini, Erika Owens - **Moderated by Erika Owens,&nbsp;Knight-Mozilla OpenNews | URL: http://ire.org/events-and-training/event/1574/1982/",Salon D,False
,Tools for transparency from the Sunlight Foundation (Sponsored by Knight Foundation),2015-06-05,4:50 p.m.,2015-06-05,6:00:00 p.m.,False,"Speakers: Bill Allison, Jacob Fenton, Robert Lannon, Ryan Sibley - See first hand new and improved tools, and get a preview of coming attractions from the Sunlight Foundation. We'll demo tools that can help you research people, follow all the money sluicing through the electoral system -- whether its lobbyists working legislators or dark money groups taking to the airwaves, learn the latest about criminal justice data, and more.&nbsp; | URL: http://ire.org/events-and-training/event/1574/2005/",Franklin 7,False
,SHOWCASE PANEL: The New Muckrakers - The expanding world of investigative journalism,2015-06-05,4:50 p.m.,2015-06-05,6:00:00 p.m.,False,"Speakers: Shani Hilton, Bill Keller, Jason Mojica, Betsy Reed, Andy Donohue - **Moderated by Andy Donohue, Reveal/CIR | URL: http://ire.org/events-and-training/event/1574/1994/",Salon E,False
spreadsheets,Examining voter access issues: Covering the fight over the right to vote (Sponsored by Rockefeller Brothers Fund),2015-06-05,4:50 p.m.,2015-06-05,6:00:00 p.m.,False,"Speakers: Ari Berman, Paul Overberg, Myrna Perez - As the 2016 election campaign begins, a pitched battle over who can vote has been already well underway &nbsp;&mdash; in legislatures, at the ballot box and especially in the courts. The Supreme Court recently weakened a key section of the Voting Rights Act, guaranteeing more battles to come. This panel will show you changes to watch for in your state, how to get information to tell the story and how to find and analyze local data on voters and voting. | URL: http://ire.org/events-and-training/event/1574/2103/",Franklin 1&amp;2,False
,IRE Conference Registration (Saturday),2015-06-06,8:00:00 a.m.,2015-06-06,5:00:00 p.m.,False,Registration will be located on the 4th floor of the Philadelphia Marriott Downtown.&nbsp; | URL: http://ire.org/events-and-training/event/1574/2088/,Franklin Hall Foyer,False
,IRE Sales Table (Saturday),2015-06-06,8:00:00 a.m.,2015-06-06,5:00:00 p.m.,False,"Stop by the IRE sales table and take a look at our merchandise. We will be selling books, the large selection of titles we carry will certainly include your interests. All proceeds from your purchase help support IRE and its mission. &nbsp;Sales will be located on the 4th floor of the Philadelphia Marriott Downtown. | URL: http://ire.org/events-and-training/event/1574/2091/",Franklin Hall Foyer,False
maps,Intro to mapping with QGIS: Importing and displaying data,2015-06-06,8:30 a.m.,2015-06-06,9:30 a.m.,False,Speakers: Alexandra Kanik | URL: http://ire.org/events-and-training/event/1574/2044/,Room 402,False
,Show &amp; Tell (Saturday - #1),2015-06-06,8:30 a.m.,2015-06-06,9:30 a.m.,False,"Speakers: Greg Amante - **Moderated by Greg Amante, ESPN's Outside the Lines | URL: http://ire.org/events-and-training/event/1574/2070/",Franklin 8,False
,From the newsroom to the classroom,2015-06-06,8:30 a.m.,2015-06-06,9:30 a.m.,False,"Speakers: Rosemary Armao, Cheryl Phillips, James F McGinnis, Dawn Fallik - **Moderated by Dawn Fallik, University of Delaware | URL: http://ire.org/events-and-training/event/1574/1933/",Franklin 5&amp;6,False
,Investigating what we eat,2015-06-06,8:30 a.m.,2015-06-06,9:30 a.m.,False,"Speakers: Mike McGraw, Duff Wilson, Bernice Yeung, Rose Ciotta - Pesticides, hormones, antibiotics, bacteria and inadequate inspections have turned food into a hot subject for investigation. This panel will cover how to get behind hype and government stonewalling to report on food safety &nbsp;in an era of global trade. Topics include labeling and what consumers need to know. | URL: http://ire.org/events-and-training/event/1574/1912/",Franklin 3&amp;4,False
,Beacon: Embracing and Communicating Impact (Sponsored by Knight Foundation),2015-06-06,8:30 a.m.,2015-06-06,9:30 a.m.,False,"Speakers: Adrian Sanders - Readers are constantly bombarded with breaking and important stories everyday. So why do they keep funding them on Beacon (more than $1m paid to journalist to date)? We&rsquo;ve learned that readers fund work because they believe in its potential for impact. We&rsquo;ll explore the future of funding investigative reporting, and how impact plays a critical role in the value delivered to readers.&nbsp; | URL: http://ire.org/events-and-training/event/1574/1942/",Franklin 7,False
,Broadcast: Breaking news investigations,2015-06-06,8:30 a.m.,2015-06-06,9:30 a.m.,False,"Speakers: Megan Chuchmach, Jodie Fleischer, Scott MacFarlane | URL: http://ire.org/events-and-training/event/1574/1935/",Franklin 9&amp;10,False
,Web scraping for anyone,2015-06-06,8:30 a.m.,2015-06-06,9:30 a.m.,False,"Speakers: Samantha Sunne - You don't have to write code to coax data off the web - with some clicks and tricks and elbow grease, you can get data and documents even your sources don't want you to have. We'll cover tools you can use out of the box, more advanced techniques, plus secret Internet passageways to the data you want. | URL: http://ire.org/events-and-training/event/1574/2035/",Room 401,False
databases,Using SQL to interrogate data (part 1),2015-06-06,8:30 a.m.,2015-06-06,9:30 a.m.,False,"Speakers: Malik Singleton - SQL lets you ""ask"" questions of your data. Run queries to get additional background research from datasets so that you'll have evidence-based questions for your interviews. This first of three sessions will show you how to use Firefox's free SQLite Manager extension, the best way to start learning the language that reads like English questions. | URL: http://ire.org/events-and-training/event/1574/2050/",Room 404,False
,Audio class with Reveal 1 (pre-registered attendees only),2015-06-06,8:30 a.m.,2015-06-06,9:30 a.m.,False,"Wondering how to turn your stories into driveway moments and compelling audio narrative? Then come to an intensive three hour workshop with award winning radio journalists from Reveal, the new investigative program from The Center for Investigative Reporting and PRX. | URL: http://ire.org/events-and-training/event/1574/2080/",Room 414/415,False
,On the beat: Healthcare,2015-06-06,8:30 a.m.,2015-06-06,9:30 a.m.,False,"Speakers: JoNel Aleccia, Joanne Faryon, Christopher Weaver, Alison Young - **Moderated by Alison Young, USA TODAY | URL: http://ire.org/events-and-training/event/1574/2115/",Salon G,False
,Social media innovations: Investigative reporting and social documentary photography,2015-06-06,8:30 a.m.,2015-06-06,9:30 a.m.,False,"Speakers: Nina Berman, Jeff Kelly Lowenstein - Documentary photographers and investigative journalists often come together at the end of a long-term project, but this session will explore what happens when photographers and investigative reporters are in active and ongoing collaboration, particularly in the social media arena. The panel will show multiple examples of how photographers and investigative journalists can use the Instagram platform, and others, to build deeper and wider engagement, reach a national and international audiences and build new sources and story ledes. It is open to all people interested in investigative journalism, photography and your work having the widest possible audience and impact.&nbsp; | URL: http://ire.org/events-and-training/event/1574/1895/",Franklin 1&amp;2,False
maps,More with QGIS: Basic geographic analysis,2015-06-06,9:40 a.m.,2015-06-06,10:40 a.m.,False,Speakers: Alex Richards - In this class we&rsquo;ll tackle a project to join tables of data together with existing shapefiles and process data consisting of hundreds or thousands of points to give a more meaningful summary display. We&rsquo;ll also cover some of the fundamentals of editing geographic data and saving it in web-ready formats.&nbsp; | URL: http://ire.org/events-and-training/event/1574/2045/,Room 402,False
,Broadcast: 60 stories in 60 minutes,2015-06-06,9:40 a.m.,2015-06-06,10:40 a.m.,False,"Speakers: Nicole Vap, Lee Zurik - This may be the one panel where you will get stories you can take back to your newsroom and get started on the day you get back from IRE. These 60 stories from broadcast investigative reporters around the country will give you story ideas that will keep you busy until the IRE conference in 2016. | URL: http://ire.org/events-and-training/event/1574/1949/",Franklin 9&amp;10,False
,Data visualization for reporting (Sponsored by Knight Foundation),2015-06-06,9:40 a.m.,2015-06-06,10:40 a.m.,False,"Speakers: Kate Golden, Jaeah Lee - Graphics! They can help us find interesting story ideas, or pinpoint numbers to use as evidence in our reporting. Often we think of graphics as an end product. When used for reporting, however, graphics are a powerful tool to explore trends and stories. We'll discuss what types of visualizations can help you find stories you may miss, make some visualizations right in Excel, and demo some easy, non-programmatic tools that allow you to go deeper in your data. We'll also cover both numbers and unstructured text as data. These visualizations are not for publication, but rather a sketchpad for reporters and data analysts. | URL: http://ire.org/events-and-training/event/1574/1955/",Franklin 7,False
,Show &amp; Tell (Saturday - #2),2015-06-06,9:40 a.m.,2015-06-06,10:40 a.m.,False,"Speakers: Dan Krauth - **Moderated by Dan Krauth, NBC6 Miami | URL: http://ire.org/events-and-training/event/1574/2071/",Franklin 8,False
,Audio class with Reveal 2 (pre-registered attendees only),2015-06-06,9:40 a.m.,2015-06-06,10:40 a.m.,False,This is a continuation of Audio class with Reveal 1. Please note: Seating is limited and preregistration is required. | URL: http://ire.org/events-and-training/event/1574/2122/,Room 414/415,False
,Buying influence: How to track lobbyists (Sponsored by Rockefeller Brothers Fund),2015-06-06,9:40 a.m.,2015-06-06,10:40 a.m.,False,"Speakers: Sandra Fish, James Grimaldi, Eric Lipton - Federal law requires lobbyists to register ​with Congress​. But that registration is just a tip sheet of sorts to getting a full picture of how various corporations are attempting to move their agendas in Washington--or in state capitols where they might also register a lobbying team. We take a look at some of the ​tools and techniques to build out a fuller, more narrative picture of what lobbying looks like by tapping into various databases, websites and other spots. ​We also discuss how states ​require a varying level of reporting, from basic registration to disclosure of payments from clients​ and ​contributions to lawmakers​.​​ ​And we reverse engineer a few stories--to show how the information needed to get a lobbying story on page one came together. | URL: http://ire.org/events-and-training/event/1574/1950/",Salon G,False
spreadsheets,Advanced Excel functions,2015-06-06,9:40 a.m.,2015-06-06,10:40 a.m.,False,"Speakers: Aaron Kessler - Learn about advanced tricks in Excel that will blow your mind and give you control over your data like never before. Is the government giving you dirty records, or hassling you about how they are formatted? Do you wish there was a column that told you ""X"" and find yourself manually typing it in? &nbsp;Never again! &nbsp;Learn ways to free yourself from such trivial restraints and work your magic over columns and rows like a pro. | URL: http://ire.org/events-and-training/event/1574/2036/",Room 401,False
,Getting great stories from hidden data sets,2015-06-06,9:40 a.m.,2015-06-06,10:40 a.m.,False,"Speakers: Sarah Cohen, Brad Heath, Janet Roberts, John Hillkirk - **Moderated by John Hillkirk, USA TODAY | URL: http://ire.org/events-and-training/event/1574/1974/",Franklin 1&amp;2,False
,Investigating black boxes,2015-06-06,9:40 a.m.,2015-06-06,10:40 a.m.,False,"Speakers: Julia Angwin, Reg Chua, Nicholas Diakopoulos, Jeremy Singer-Vine - Algorithms increasingly dominate our lives - influencing what information we find, where police are deployed, how stocks are priced, what we're charged for goods. Yet the public's understanding - and media coverage - of these new gatekeepers is still in its infancy. How should and can we be investigating these black boxes, and what are the technical, journalistic and legal challenges involved? &nbsp; | URL: http://ire.org/events-and-training/event/1574/1947/",Franklin 3&amp;4,False
,How to become an instant expert on a topic through Google,2015-06-06,9:40 a.m.,2015-06-06,10:40 a.m.,False,"Speakers: Daniel Russell - It's happened to you--you need to do a story on a topic that's completely outside of your experience. Surely there's someone more qualified? The answer is usually NO. Now what? Now you have to come up to speed on that topic ASAP. In this mini-course, you&rsquo;ll learn strategies and tactics to use to learn a domain as rapidly as possible. You won't be an expert, but you'll have a bunch of tips and methods to get to competence quickly. You won&rsquo;t learn to pass the PhD exam in quantum physics, but a little knowledge about learning and Google search strategies can get you through that story. | URL: http://ire.org/events-and-training/event/1574/1952/",Salon K/L,False
,Investigating the military,2015-06-06,9:40 a.m.,2015-06-06,10:40 a.m.,False,"Speakers: Mark Greenblatt, Eva Parks, Mary Walsh - This panel is not just three reporters telling &ldquo;war stories&rdquo; but experienced journalists sharing their tips and secrets for uncovering and discovering military information. &nbsp;Learn how you can incorporate some of the same tools and strategies the panelists used to report on a military reporting loophole on sex offenders, soldiers&rsquo; complaints of mistreatment and abuse, and groundbreaking behind-the-scenes stories. &nbsp;And once you&rsquo;ve gotten in the door &ndash; then what? &nbsp;From navigating military records, to convincing soldiers and military leaders to talk, practical advice you can take back to your shop.&nbsp; | URL: http://ire.org/events-and-training/event/1574/1948/",Franklin 5&amp;6,False
databases,Using SQL to interrogate data (part 2),2015-06-06,9:40 a.m.,2015-06-06,10:40 a.m.,False,"Speakers: Meghan Hoyer - The second session in the SQLite workshop will build up your SQL muscles, adding some common tasks that journalists need every day: checking for missing data, grouping your data, getting counts and sums and doing math in SQL. | URL: http://ire.org/events-and-training/event/1574/2051/",Room 404,False
,Liberating data from PDFs,2015-06-06,10:50 a.m.,2015-06-06,11:50 a.m.,False,Speakers: Grant Smith - Want to stick it to government bureaucrats that think they'll foil your investigation by turning over public data in PDFs? Show them who's boss by turning nasty PDFs into usable data. This session is good for PDF newbies. | URL: http://ire.org/events-and-training/event/1574/2037/,Room 401,False
databases,Using SQL to interrogate data (part 3),2015-06-06,10:50 a.m.,2015-06-06,11:50 a.m.,False,"Speakers: Griff Palmer - This session will show how enterprising reporters can take data sets never designed to be joined together, and in the joining, come up with stories. We will also devote time to conditional grouping of data. | URL: http://ire.org/events-and-training/event/1574/2052/",Room 404,False
,Doing investigations with students,2015-06-06,10:50 a.m.,2015-06-06,11:50 a.m.,False,"Speakers: David Armstrong, Sheila Coronel, Julia Harte, Joanna Zuckerman Bernstein, Brant Houston - **Moderated by Brant Houston, University of Illinois at Urbana-Champaign | URL: http://ire.org/events-and-training/event/1574/1959/",Franklin 3&amp;4,False
,Reporting and tracking with Storify (Sponsored by Knight Foundation),2015-06-06,10:50 a.m.,2015-06-06,11:50 a.m.,False,"Speakers: Doug Haddix - Explore a new way of using Storify -- as a private gathering place for your social media reporting and tracking. Learn how to set up private drafts in Storify as an efficient way of searching and saving social media posts from Twitter, Facebook, Instagram, YouTube, Tumblr and other platforms. Organize by beat or sources. Turn Storify into your own personal social media reporter's notebook. | URL: http://ire.org/events-and-training/event/1574/1968/",Franklin 7,False
