Topic,Subject,Start Date,Start Time,End Date,End Time,All Day Event,Description,Location,Privateregex,Cleaning data with regular expressions and more,6/5/15,4:45 p.m.,6/5/15,6:00:00 p.m.,FALSE,Speakers: Agustin Armendariz | URL: http://ire.org/events-and-training/event/1574/2025/,Room 404,FALSE,Show &amp; Tell (Friday - #5),6/5/15,4:45 p.m.,6/5/15,6:00:00 p.m.,FALSE,Show &amp; Tell sessions allow you to share your investigations with colleagues from around the country. Veteran broadcasters will moderate each session. Each slot runs for 10 minutes and includes a 5-minute break. | URL: http://ire.org/events-and-training/event/1574/2069/,Franklin 8,FALSE,Working with whistleblowers,6/5/15,4:45 p.m.,6/5/15,6:00:00 p.m.,FALSE,"Speakers: Scott Bronstein, Steve Riley, Dennis Wagner, Sarah Cohen - **Moderated by Sarah Cohen, The New York Times | URL: http://ire.org/events-and-training/event/1574/2105/",Franklin 5&amp;6,FALSE,Finding the story: Contracts,6/5/15,4:45 p.m.,6/5/15,6:00:00 p.m.,FALSE,Speakers: Danielle Ivory | URL: http://ire.org/events-and-training/event/1574/2019/,Room 401,FALSEspreadsheets,Examining voter access issues (Sponsored by Rockefeller Brothers Fund),6/5/15,4:45 p.m.,6/5/15,6:00:00 p.m.,FALSE,"Speakers: Ari Berman, Paul Overberg, Myrna Perez | URL: http://ire.org/events-and-training/event/1574/2103/",Franklin 1&amp;2,FALSE,Tools for transparency from the Sunlight Foundation (Sponsored by Knight Foundation),6/5/15,4:45 p.m.,6/5/15,6:00:00 p.m.,FALSE,"Speakers: Bill Allison, Jacob Fenton, Robert Lannon, Ryan Sibley - See first hand new and improved tools, and get a preview of coming attractions from the Sunlight Foundation. We'll demo tools that can help you research people, follow all the money sluicing through the electoral system -- whether its lobbyists working legislators or dark money groups taking to the airwaves, learn the latest about criminal justice data, and more.&nbsp; | URL: http://ire.org/events-and-training/event/1574/2005/",Franklin 7,FALSE,Oil on the tracks: Covering the explosive story of crude trains (Sponsored by Society of Environmental Journalists),6/5/15,4:45 p.m.,6/5/15,6:00:00 p.m.,FALSE,"Speakers: Russell Gold - **Moderated by Russell Gold, The Wall Street Journal | URL: http://ire.org/events-and-training/event/1574/2104/",Franklin 3&amp;4,FALSE,Quantity and quality,6/5/15,4:45 p.m.,6/5/15,6:00:00 p.m.,FALSE,"Speakers: Aaron Diamant, John Ferrugia, David Raziq | URL: http://ire.org/events-and-training/event/1574/1970/",Salon C,FALSE,Digital presentation for investigations,6/5/15,4:45 p.m.,6/5/15,6:00:00 p.m.,FALSE,"Speakers: Paul Cheung, Benjamin Herold, Giannina Segnini, Erika Owens - **Moderated by Erika Owens,&nbsp;Knight-Mozilla OpenNews | URL: http://ire.org/events-and-training/event/1574/1982/",Salon D,FALSE,IRE Conference Registration (Saturday),6/6/15,8:00:00 a.m.,6/6/15,5:00:00 p.m.,FALSE,Registration will be located on the 4th floor of the Philadelphia Marriott Downtown.&nbsp; | URL: http://ire.org/events-and-training/event/1574/2088/,Franklin Hall Foyer,FALSE,IRE Sales Table (Saturday),6/6/15,8:00:00 a.m.,6/6/15,5:00:00 p.m.,FALSE,"Stop by the IRE sales table and take a look at our merchandise. We will be selling books, the large selection of titles we carry will certainly include your interests. All proceeds from your purchase help support IRE and its mission. &nbsp;Sales will be located on the 4th floor of the Philadelphia Marriott Downtown. | URL: http://ire.org/events-and-training/event/1574/2091/",Franklin Hall Foyer,FALSE,Web scraping for anyone,6/6/15,8:30 a.m.,6/6/15,9:30 a.m.,FALSE,Speakers: Samantha Sunne | URL: http://ire.org/events-and-training/event/1574/2035/,Room 401,FALSE,Broadcast: Breaking news investigations,6/6/15,8:30 a.m.,6/6/15,9:30 a.m.,FALSE,"Speakers: Megan Chuchmach, Jodie Fleischer, Scott MacFarlane | URL: http://ire.org/events-and-training/event/1574/1935/",Franklin 9&amp;10,FALSE,From the newsroom to the classroom,6/6/15,8:30 a.m.,6/6/15,9:30 a.m.,FALSE,"Speakers: Rosemary Armao, Cheryl Phillips, James F McGinnis, Dawn Fallik - **Moderated by Dawn Fallik, University of Delaware | URL: http://ire.org/events-and-training/event/1574/1933/",Franklin 5&amp;6,FALSE,Social media innovations: Investigative reporting and social documentary photography,6/6/15,8:30 a.m.,6/6/15,9:30 a.m.,FALSE,"Speakers: Nina Berman, Jeff Kelly Lowenstein - Documentary photographers and investigative journalists often come together at the end of a long-term project, but this session will explore what happens when photographers and investigative reporters are in active and ongoing collaboration, particularly in the social media arena. The panel will show multiple examples of how photographers and investigative journalists can use the Instagram platform, and others, to build deeper and wider engagement, reach a national and international audiences and build new sources and story ledes. It is open to all people interested in investigative journalism, photography and your work having the widest possible audience and impact.&nbsp; | URL: http://ire.org/events-and-training/event/1574/1895/",Franklin 1&amp;2,FALSE,On the beat: Healthcare,6/6/15,8:30 a.m.,6/6/15,9:30 a.m.,FALSE,"Speakers: JoNel Aleccia, Joanne Faryon, Christopher Weaver, Alison Young - **Moderated by Alison Young, USA TODAY | URL: http://ire.org/events-and-training/event/1574/2115/",Salon G,FALSE,Audio class with Reveal 1 (pre-registered attendees only),6/6/15,8:30 a.m.,6/6/15,9:30 a.m.,FALSE,Speakers: TBA | URL: http://ire.org/events-and-training/event/1574/2080/,Room 414/415,FALSE,Investigating what we eat,6/6/15,8:30 a.m.,6/6/15,9:30 a.m.,FALSE,"Speakers: Mike McGraw, Duff Wilson, Bernice Yeung, Rose Ciotta - Pesticides, hormones, antibiotics, bacteria and inadequate inspections have turned food into a hot subject for investigation. This panel will cover how to get behind hype and government stonewalling to report on food safety &nbsp;in an era of global trade. Topics include labeling and what consumers need to know. | URL: http://ire.org/events-and-training/event/1574/1912/",Franklin 3&amp;4,FALSEmaps,Intro to mapping with QGIS: Importing and displaying data,6/6/15,8:30 a.m.,6/6/15,9:30 a.m.,FALSE,Speakers: Alexandra Kanik | URL: http://ire.org/events-and-training/event/1574/2044/,Room 402,FALSEdatabases,Using SQL to interrogate data (part 1),6/6/15,8:30 a.m.,6/6/15,9:30 a.m.,FALSE,Speakers: Malik Singleton | URL: http://ire.org/events-and-training/event/1574/2050/,Room 404,FALSE,Show &amp; Tell (Saturday - #1),6/6/15,8:30 a.m.,6/6/15,9:30 a.m.,FALSE,Show &amp; Tell sessions allow you to share your investigations with colleagues from around the country. Veteran broadcasters will moderate each session. Each slot runs for 10 minutes and includes a 5-minute break. | URL: http://ire.org/events-and-training/event/1574/2070/,Franklin 8,FALSE,Beacon (Sponsored by Knight Foundation),6/6/15,8:30 a.m.,6/6/15,9:30 a.m.,FALSE,Speakers: Adrian Sanders | URL: http://ire.org/events-and-training/event/1574/1942/,Franklin 7,FALSEmaps,More with QGIS: Basic geographic analysis,6/6/15,9:40 a.m.,6/6/15,10:40 a.m.,FALSE,Speakers: Alex Richards - In this class we&rsquo;ll tackle a project to join tables of data together with existing shapefiles and process data consisting of hundreds or thousands of points to give a more meaningful summary display. We&rsquo;ll also cover some of the fundamentals of editing geographic data and saving it in web-ready formats.&nbsp; | URL: http://ire.org/events-and-training/event/1574/2045/,Room 402,FALSE,Data visualization for reporting (Sponsored by Knight Foundation),6/6/15,9:40 a.m.,6/6/15,10:40 a.m.,FALSE,"Speakers: Kate Golden, Jaeah Lee | URL: http://ire.org/events-and-training/event/1574/1955/",Franklin 7,FALSE,How to become an instant expert on a topic through Google,6/6/15,9:40 a.m.,6/6/15,10:40 a.m.,FALSE,"Speakers: Daniel Russell - It's happened to you--you need to do a story on a topic that's completely outside of your experience. Surely there's someone more qualified? The answer is usually NO. Now what? Now you have to come up to speed on that topic ASAP. In this mini-course, you&rsquo;ll learn strategies and tactics to use to learn a domain as rapidly as possible. You won't be an expert, but you'll have a bunch of tips and methods to get to competence quickly. You won&rsquo;t learn to pass the PhD exam in quantum physics, but a little knowledge about learning and Google search strategies can get you through that story. | URL: http://ire.org/events-and-training/event/1574/1952/",Salon K/L,FALSEdatabases,Using SQL to interrogate data (part 2),6/6/15,9:40 a.m.,6/6/15,10:40 a.m.,FALSE,Speakers: Meghan Hoyer | URL: http://ire.org/events-and-training/event/1574/2051/,Room 404,FALSE,Investigating black boxes,6/6/15,9:40 a.m.,6/6/15,10:40 a.m.,FALSE,"Speakers: Julia Angwin, Reg Chua, Nicholas Diakopoulos, Jeremy Singer-Vine - Algorithms increasingly dominate our lives - influencing what information we find, where police are deployed, how stocks are priced, what we're charged for goods. Yet the public's understanding - and media coverage - of these new gatekeepers is still in its infancy. How should and can we be investigating these black boxes, and what are the technical, journalistic and legal challenges involved? &nbsp; | URL: http://ire.org/events-and-training/event/1574/1947/",Franklin 3&amp;4,FALSE,Show &amp; Tell (Saturday - #2),6/6/15,9:40 a.m.,6/6/15,10:40 a.m.,FALSE,Show &amp; Tell sessions allow you to share your investigations with colleagues from around the country. Veteran broadcasters will moderate each session. Each slot runs for 10 minutes and includes a 5-minute break. | URL: http://ire.org/events-and-training/event/1574/2071/,Franklin 8,FALSEspreadsheets,Advanced Excel functions,6/6/15,9:40 a.m.,6/6/15,10:40 a.m.,FALSE,Speakers: Aaron Kessler | URL: http://ire.org/events-and-training/event/1574/2036/,Room 401,FALSE,Buying influence: How to track lobbyists (Sponsored by Rockefeller Brothers Fund),6/6/15,9:40 a.m.,6/6/15,10:40 a.m.,FALSE,"Speakers: Sandra Fish, James Grimaldi, Eric Lipton - Federal law requires lobbyists to register with Congress. But that registration is just a tip sheet of sorts to getting a full picture of how various corporations are attempting to move their agendas in Washington--or in state capitols where they might also register a lobbying team. We take a look at some of the tools and techniques to build out a fuller, more narrative picture of what lobbying looks like by tapping into various databases, websites and other spots. We also discuss how states require a varying level of reporting, from basic registration to disclosure of payments from clients and contributions to lawmakers. And we reverse engineer a few stories--to show how the information needed to get a lobbying story on page one came together. | URL: http://ire.org/events-and-training/event/1574/1950/",Salon G,FALSE,Investigating the military,6/6/15,9:40 a.m.,6/6/15,10:40 a.m.,FALSE,"Speakers: Mark Greenblatt, Eva Parks, Mary Walsh | URL: http://ire.org/events-and-training/event/1574/1948/",Franklin 5&amp;6,FALSE,Audio class with Reveal 2 (pre-registered attendees only),6/6/15,9:40 a.m.,6/6/15,10:40 a.m.,FALSE,Speakers: TBA | URL: http://ire.org/events-and-training/event/1574/2122/,Room 414/415,FALSE,"The divide: Race, economics and law enforcement (Sponsored by Temple University School of Media and Communication)",6/6/15,9:40 a.m.,6/6/15,10:40 a.m.,FALSE,"Speakers: Nikole Hannah-Jones, Kimbriell Kelly, Frances Robles | URL: http://ire.org/events-and-training/event/1574/1944/",Franklin 1&amp;2,FALSE,Broadcast: 60 stories in 60 minutes,6/6/15,9:40 a.m.,6/6/15,10:40 a.m.,FALSE,"Speakers: Nicole Vap, Lee Zurik - This may be the one panel where you will get stories you can take back to your newsroom and get started on the day you get back from IRE. These 60 stories from broadcast investigative reporters around the country will give you story ideas that will keep you busy until the IRE conference in 2016. | URL: http://ire.org/events-and-training/event/1574/1949/",Franklin 9&amp;10,FALSE,Pick &amp; choose environmental investigations (Sponsored by Society of Environmental Journalists),6/6/15,10:50 a.m.,6/6/15,11:50 a.m.,FALSE,"Speakers: Joseph Davis, Robert McClure, Andrea Rodgers, Naveena Sadasivam, Jeff Burnside - **Moderated by Jeff Burnside, KOMO-Seattle | URL: http://ire.org/events-and-training/event/1574/1957/",Franklin 1&amp;2,FALSE,Broadcast: Story structure,6/6/15,10:50 a.m.,6/6/15,11:50 a.m.,FALSE,"Speakers: Solly Granatstein, Brendan Keefe, Chris Vanderveen, Matt Goldberg - **Moderated by Matt Goldberg, NBC4 Los Angeles | URL: http://ire.org/events-and-training/event/1574/1962/",Franklin 9&amp;10,FALSE,Show &amp; Tell (Saturday - #3),6/6/15,10:50 a.m.,6/6/15,11:50 a.m.,FALSE,Show &amp; Tell sessions allow you to share your investigations with colleagues from around the country. Veteran broadcasters will moderate each session. Each slot runs for 10 minutes and includes a 5-minute break. | URL: http://ire.org/events-and-training/event/1574/2073/,Franklin 8,FALSE,Map like a pro with ArcGIS online,6/6/15,10:50 a.m.,6/6/15,11:50 a.m.,FALSE,"Speakers: Robby Deming, Brian Peterson - We all live in a realm of data. But sometimes, spreadsheets and databases aren't the best way to tell your story. Take a hands-on tour of the redesigned ArcGIS Online to see how you can easily create intelligent maps in minutes. Learn how the new Smart Mapping feature in ArcGIS Online can help you investigate patterns in your data and easily create beautiful data visualizations, even if you've never worked with maps or GIS before. If you can use an Internet browser, you can create award-winning maps. | URL: http://ire.org/events-and-training/event/1574/2046/",Room 402,FALSE,Doing investigations with students,6/6/15,10:50 a.m.,6/6/15,11:50 a.m.,FALSE,"Speakers: David Armstrong, Sheila Coronel, Julia Harte, Joanna Zuckerman Bernstein, Brant Houston - **Moderated by Brant Houston, University of Illinois at Urbana-Champaign | URL: http://ire.org/events-and-training/event/1574/1959/",Franklin 3&amp;4,FALSEdatabases,Using SQL to interrogate data (part 3),6/6/15,10:50 a.m.,6/6/15,11:50 a.m.,FALSE,Speakers: Griff Palmer | URL: http://ire.org/events-and-training/event/1574/2052/,Room 404,FALSE,Exploring a Post-9/11 world: A conversation with Laura Poitras,6/6/15,10:50 a.m.,6/6/15,11:50 a.m.,FALSE,"Speakers: Laura Poitras, Robert Cribb - **Moderated by Robert Cribb, Toronto Star | URL: http://ire.org/events-and-training/event/1574/1964/",Salon G,FALSE,Audio class with Reveal 3 (pre-registered attendees only),6/6/15,10:50 a.m.,6/6/15,11:50 a.m.,FALSE,Speakers: TBA | URL: http://ire.org/events-and-training/event/1574/2123/,Room 414/415,FALSE,Navigating the publishing world: From ebooks to your first novel,6/6/15,10:50 a.m.,6/6/15,11:50 a.m.,FALSE,"Speakers: Daniel Connolly, Kirsten Danis, Nancy Stancill, Jim MacMillan - **Moderated by Jim MacMillan, Temple University | URL: http://ire.org/events-and-training/event/1574/1966/",Salon K/L,FALSE,Reporting and tracking with Storify (Sponsored by Knight Foundation),6/6/15,10:50 a.m.,6/6/15,11:50 a.m.,FALSE,"Speakers: Doug Haddix - Explore a new way of using Storify -- as a private gathering place for your social media reporting and tracking. Learn how to set up private drafts in Storify as an efficient way of searching and saving social media posts from Twitter, Facebook, Instagram, YouTube, Tumblr and other platforms. Organize by beat or sources. Turn Storify into your own personal social media reporter's notebook. | URL: http://ire.org/events-and-training/event/1574/1968/",Franklin 7,FALSE,Management track: Balancing enterprise with everything else,6/6/15,10:50 a.m.,6/6/15,11:50 a.m.,FALSE,"Speakers: Gabriel Escobar, Kevin Merida, Richard Wiens, Kate Marymont - **Moderated by Kate Marymont, Gannett Company, Inc. | URL: http://ire.org/events-and-training/event/1574/1961/",Franklin 5&amp;6,FALSE,Liberating data from PDFs,6/6/15,10:50 a.m.,6/6/15,11:50 a.m.,FALSE,Speakers: Grant Smith | URL: http://ire.org/events-and-training/event/1574/2037/,Room 401,FALSE,IRE Awards Luncheon featuring keynote speaker James Risen of The New York Times,6/6/15,noon,6/6/15,2:00:00 p.m.,FALSE,"A highlight of the IRE conference, the IRE Awards Luncheon begins at noon on Saturday in Salon A-F. We will present the 2014 IRE Awards and salute some of the best investigative work of the past year. | URL: http://ire.org/events-and-training/event/1574/2094/",Salon A-F,FALSE"statistics, spreadsheets",Doing stats in Excel,6/6/15,2:30 p.m.,6/6/15,3:30 p.m.,FALSE,Speakers: David Donald - You're comfortable doing data analysis in spreadsheets for your stories but would like to take your data journalism skills to the next level. This session introduces using statistics for stories through the comfort of Microsoft Excel. It will cover a more systematic way of thinking about your approach to your data and then applying your new understanding through descriptive statistics and regression analysis with an emphasis on storytelling. Familiarity with spreadsheets is necessary but no experience with statistics is assumed. | URL: http://ire.org/events-and-training/event/1574/2047/,Room 402,FALSE,Broadcast deep dives 3,6/6/15,2:30 p.m.,6/6/15,3:30 p.m.,FALSE,"Speakers: Gio Benitez, Jeremy Finley, Jenna Susko - From undercover and interview techniques to research and records requests, watch some of the best investigative stories of the year and hear from the journalists behind the work. | URL: http://ire.org/events-and-training/event/1574/2072/",Franklin 8,FALSE,Tell me a (data) story I won&#39;t forget,6/6/15,2:30 p.m.,6/6/15,3:30 p.m.,FALSE,"Speakers: Bill Dedman, T. Christian Miller, Dylan Purcell, Jennifer LaFleur - **Moderated by Jennifer LaFleur, The Center for Investigative Reporting/Reveal | URL: http://ire.org/events-and-training/event/1574/1983/",Room 414/415,FALSE,Creating a document state of mind,6/6/15,2:30 p.m.,6/6/15,3:30 p.m.,FALSE,"Speakers: Mike McGraw, James Steele, Joe Stephens | URL: http://ire.org/events-and-training/event/1574/1979/",Salon G,FALSE,Campus coverage: Examining the cost of a college education (Sponsored by Lumina Foundation),6/6/15,2:30 p.m.,6/6/15,3:30 p.m.,FALSE,"Speakers: Kim Clark, Robert Kelchen, Jonah Newman | URL: http://ire.org/events-and-training/event/1574/1973/",Franklin 3&amp;4,FALSE,Animated video for storytelling,6/6/15,2:30 p.m.,6/6/15,3:30 p.m.,FALSE,Speakers: Kavya Sukumar | URL: http://ire.org/events-and-training/event/1574/2038/,Room 401,FALSE,From words to pictures: Text analysis and visualization (Sponsored by Knight Foundation),6/6/15,2:30 p.m.,6/6/15,3:30 p.m.,FALSE,"Speakers: Nicholas Diakopoulos - You've got a massive pile of text: Some Ferguson tweets, a box of now OCRed documents, or maybe a corpus of press releases you scraped. How do you make sense of it? In this session I'll introduce some alternatives for using text visualization to see your texts in different ways. Then I'll talk about some of the machinery for text analysis that you'll need to get there, with pointers out to Python tools. Next year you'll be visualizing the SOTU like a pro. | URL: http://ire.org/events-and-training/event/1574/1985/",Franklin 7,FALSEpython,An introduction to Python (part 1),6/6/15,2:30 p.m.,6/6/15,3:30 p.m.,FALSE,Speakers: Tom Meagher | URL: http://ire.org/events-and-training/event/1574/2053/,Room 404,FALSE,Beyond words: Storytelling at the intersection of cool &amp; creative,6/6/15,2:30 p.m.,6/6/15,3:30 p.m.,FALSE,"Speakers: Gabriel Dance, Amy Julia Harris, Tori Marlan, Ken Armstrong - **Moderated by Ken Armstrong, The Marshall Project | URL: http://ire.org/events-and-training/event/1574/1981/",Salon K/L,FALSE,"Broadcast: Hitting the ground running - new market, new beat",6/6/15,2:30 p.m.,6/6/15,3:30 p.m.,FALSE,"Speakers: Danielle Leigh, Wendy Saltzman, Mc Nelly Torres - Many people switch jobs, switch beats, or have to learn a new medium. This panel will give tips on how to hit the ground running with stories and ideas as soon as you start. | URL: http://ire.org/events-and-training/event/1574/1977/",Franklin 9&amp;10,FALSE,Immigration: What part of &quot;illegal&quot; don&#39;t you understand? (Sponsored by Criminal Justice Journalists),6/6/15,2:30 p.m.,6/6/15,3:30 p.m.,FALSE,"Speakers: Cindy Carcamo, Lawrence Downes, Maria Sacchetti, Michael Matza - **Moderated by Michael Matza, The Philadelphia Inquirer | URL: http://ire.org/events-and-training/event/1574/1975/",Franklin 5&amp;6,FALSE,Management track: You want to do what? Vetting story ideas,6/6/15,2:30 p.m.,6/6/15,3:30 p.m.,FALSE,"Speakers: Lois Norder, Mark Rochester, George Stanley, Robert Rosenthal - **Moderated by Robert Rosenthal, Reveal/CIR | URL: http://ire.org/events-and-training/event/1574/1971/",Franklin 1&amp;2,FALSE,Humanizing numbers,6/6/15,3:40 p.m.,6/6/15,4:40 p.m.,FALSE,"Speakers: Jennifer LaFleur, Paula Lavigne, Ron Nixon | URL: http://ire.org/events-and-training/event/1574/1917/",Salon G,FALSE,Human rights reporting (Sponsored by Temple University School of Media and Communication),6/6/15,3:40 p.m.,6/6/15,4:40 p.m.,FALSE,"Speakers: John Carlos Frey, Michael Hudson, Syed Nazakat | URL: http://ire.org/events-and-training/event/1574/1988/",Franklin 5&amp;6,FALSE,Broadcast: Managing the broadcast team,6/6/15,3:40 p.m.,6/6/15,4:40 p.m.,FALSE,"Speakers: Jennifer Cobb, Debra Juarez, Nicole Vap | URL: http://ire.org/events-and-training/event/1574/1991/",Franklin 9&amp;10,FALSE,Campus coverage: Investigating student rights violations - From fraternities to the administration (Sponsored by Lumina Foundation),6/6/15,3:40 p.m.,6/6/15,4:40 p.m.,FALSE,"Speakers: Walt Bogdanich, Duane Pohlman, Samantha Sunne, Frank LoMonte - **Moderated by Frank LoMonte, Student Press Law Center | URL: http://ire.org/events-and-training/event/1574/1995/",Room 414/415,FALSE,Avoiding prying eyes,6/6/15,3:40 p.m.,6/6/15,4:40 p.m.,FALSE,"Speakers: Julia Angwin, Jack Gillum, Trish Wilson, Jesse Holcomb - **Moderated by Jesse Holcomb,&nbsp;Pew Research Center | URL: http://ire.org/events-and-training/event/1574/2030/",Franklin 1&amp;2,FALSE,Free tools to get the job done (Sponsored by Knight Foundation),6/6/15,3:40 p.m.,6/6/15,4:40 p.m.,FALSE,"Speakers: Matt Carroll, Adam Schweigert | URL: http://ire.org/events-and-training/event/1574/1997/",Franklin 7,FALSE,Reporting on diverse communities that aren&#39;t your own (Sponsored by Asian American Journalists Association),6/6/15,3:40 p.m.,6/6/15,4:40 p.m.,FALSE,"Speakers: Sheila Coronel, Michael Matza, Sabrina Vourvoulias, Sherry Yu - What are the challenges journalists face when covering diverse communities that are not their own? Barriers of language and access can hinder deeper reporting, and thorny issues around race and cultures can offend readers and harm their subjects. Panelists will not only explore why more and better stories about underrepresented or marginalized groups is valuable and necessary for news organizations, but provide journalists with insights and methods for how to improve their reporting on people and places that newsrooms often fail to cover.&nbsp; | URL: http://ire.org/events-and-training/event/1574/1993/",Salon K/L,FALSE,Geocoding: Turning addresses into locations,6/6/15,3:40 p.m.,6/6/15,4:40 p.m.,FALSE,"Speakers: Liz Lucas - Have you ever received data that included addresses? In this session we'll talk about when it helps to display those addresses on a map, and show you how to do it using the Census Bureau's free online geocoder. We'll also talk about other free (or cheap) geocoding services and discuss checking for accuracy and avoiding potential traps and pitfalls. | URL: http://ire.org/events-and-training/event/1574/2039/",Room 401,FALSE,Investigating law enforcement,6/6/15,3:40 p.m.,6/6/15,4:40 p.m.,FALSE,"Speakers: Eric Flack, Jeremy Rogalski, Stephen Stock | URL: http://ire.org/events-and-training/event/1574/1987/",Franklin 3&amp;4,FALSE,Under pressure: Real life in real time with breaking news (repeat session),6/6/15,3:40 p.m.,6/6/15,4:40 p.m.,FALSE,Speakers: Stephen Stock | URL: http://ire.org/events-and-training/event/1574/2048/,Room 402,FALSE,Show &amp; Tell (Saturday - #4),6/6/15,3:40 p.m.,6/6/15,4:40 p.m.,FALSE,Show &amp; Tell sessions allow you to share your investigations with colleagues from around the country. Veteran broadcasters will moderate each session. Each slot runs for 10 minutes and includes a 5-minute break. | URL: http://ire.org/events-and-training/event/1574/2074/,Franklin 8,FALSEpython,An introduction to Python (part 2),6/6/15,3:40 p.m.,6/6/15,4:40 p.m.,FALSE,Speakers: Tom Meagher | URL: http://ire.org/events-and-training/event/1574/2054/,Room 404,FALSE,Show &amp; Tell (Saturday - #5),6/6/15,4:50 p.m.,6/6/15,5:50 p.m.,FALSE,Show &amp; Tell sessions allow you to share your investigations with colleagues from around the country. Veteran broadcasters will moderate each session. Each slot runs for 10 minutes and includes a 5-minute break. | URL: http://ire.org/events-and-training/event/1574/2075/,Franklin 8,FALSE,Broadcast: Hidden cameras,6/6/15,4:50 p.m.,6/6/15,5:50 p.m.,FALSE,"Speakers: Josh Davis, Joe Ellis, Kevin Nious - Award winning producers from local and national broadcast news outlets discuss strategies for planning and executing undercover investigations. Learn best practices and see examples of ways to covertly use affordable consumer grade cameras and professional hidden cameras. | URL: http://ire.org/events-and-training/event/1574/2000/",Franklin 9&amp;10,FALSE,Finding the story: Public debt,6/6/15,4:50 p.m.,6/6/15,5:50 p.m.,FALSE,Speakers: Cezary Podkul | URL: http://ire.org/events-and-training/event/1574/2049/,Room 402,FALSE