Topic,Subject,Start Date,Start Time,End Date,End Time,All Day Event,Description,Location,Private
,50 Apps in 30 Minutes (plus 30 minutes of other cool mobile stuff),2015-06-04,3:40 p.m.,2015-06-04,4:40 p.m.,False,"Speakers: David Ho - Supercharge your smartphone for reporting! Can't stand the idea of being without your phone? Then you can't be without this session. WSJ's executive mobile editor will help you turn your phone into a Swiss Army Knife of journalism goodness with this always-updating and fun session on apps and tools for gathering and producing news. Want to use your phone to record interviews? Take better notes? Transcribe audio? Edit video? Track Tweets? Talk on camera? ID airplanes? Translate Swahili? There's an app for that. Plus, learn about more tips, tricks and mobile gear. The mobile age is here. You should be here, too. | URL: http://ire.org/events-and-training/event/1574/1915/",Franklin 1&amp;2,False
,Tell stories about your community with real estate data (Sponsored by Knight Foundation),2015-06-04,3:40 p.m.,2015-06-04,4:40 p.m.,False,"Speakers: Skylar Olsen - Housing data is about more than just real estate. Get beyond the market reports and tell stories about your community: Watchdog government programs, profile up-and-coming neighborhoods, and inform your daily reports on transit, crime, and new development. | URL: http://ire.org/events-and-training/event/1574/1996/",Franklin 7,False
,Power couple: Data-driven reporting and people-driven narrative,2015-06-04,4:50 p.m.,2015-06-04,5:50 p.m.,False,"Speakers: Audra Burch, Michael Sallah, Steven Rich, Deborah Nelson, Carol Marbin Miller - **Moderated by Deborah Nelson, University of Maryland | URL: http://ire.org/events-and-training/event/1574/1924/",Franklin 5&amp;6,False
,Tools for small newsrooms that don&#39;t code,2015-06-04,4:50 p.m.,2015-06-04,5:50 p.m.,False,"Speakers: Alexandra Kanik, Alex Salkever, Grant Smith, Megan Luther - **Moderated by Megan Luther, IRE/NICAR | URL: http://ire.org/events-and-training/event/1574/1923/",Franklin 1&amp;2,False
,Banjo: Report the news first (Sponsored by Knight Foundation),2015-06-04,4:50 p.m.,2015-06-04,5:50 p.m.,False,"Speakers: Jennifer Peck - In today&rsquo;s world, events are captured by over 7 billion cell phones. Combine mobile access with social sharing and everyone becomes a reporter. Nearly every story is reported first by social media users. Banjo alerts you to these stories, but when breaking news happens, an alert is not enough. Banjo gives you the fastest way to get &ldquo;eyes on the ground.&rdquo; We show you everything that is happening from the people who are actually there, in real time, across all social networks. You&rsquo;ll be reporting the news as it unfolds with eyewitness sources. With Banjo, you&rsquo;ll turn signals into stories and get news out before anyone else. | URL: http://ire.org/events-and-training/event/1574/1928/",Franklin 7,False
spreadsheets,"Access to your information: Subpoenas, shield laws and more",2015-06-04,4:50 p.m.,2015-06-04,5:50 p.m.,False,"Speakers: Amy Ginensky, Gregg Leslie, Mickey Osterreicher, Maud Beelman - **Moderated by Maud Beelman, The Associated Press | URL: http://ire.org/events-and-training/event/1574/2097/",Franklin 3&amp;4,False
,On the beat: Government,2015-06-04,4:50 p.m.,2015-06-04,5:50 p.m.,False,"Speakers: Anita Hofschneider, Challen Stephens, Terri Langford, Brett Blackledge - **Moderated by Terri Langford, The Texas Tribune | URL: http://ire.org/events-and-training/event/1574/1927/",Salon L,False
,Management track: Guiding and editing the in-depth story,2015-06-04,4:50 p.m.,2015-06-04,5:50 p.m.,False,"Speakers: Dwayne Bray, Brent Walth, Gordon Witkin, Greg Borowski - **Moderated by Greg Borowski, Milwaukee Journal Sentinel | URL: http://ire.org/events-and-training/event/1574/1926/",Salon K,False
,Show &amp; Tell (Thursday - #5),2015-06-04,4:50 p.m.,2015-06-04,5:50 p.m.,False,"Speakers: Steve Eckert - **Moderated by Steve Eckert, KARE 11 Minneapolis/St. Paul | URL: http://ire.org/events-and-training/event/1574/2064/",Franklin 8,False
,Best of broadcast,2015-06-04,4:50 p.m.,2015-06-04,5:50 p.m.,False,"Speakers: Tisha Thompson - Watch and listen as the photographers, editors and producers behind this year&rsquo;s IRE Award winners and finalists explain how they did it, what they would do differently and what they were really thinking when things got hard. | URL: http://ire.org/events-and-training/event/1574/1953/",Franklin 9&amp;10,False
,INN: Executive directors meeting,2015-06-04,5:00:00 p.m.,2015-06-04,6:00:00 p.m.,False,Speakers: TBA | URL: http://ire.org/events-and-training/event/1574/2121/,Room 414-415,False
,Welcome reception (Co-Sponsored by Pepper Hamilton LLP and Calkins Media),2015-06-04,6:00:00 p.m.,2015-06-04,7:30 p.m.,False,"Kick off the conference with a welcome reception on Thursday night beginning at 6 p.m. Meet up with friends you have not seen since last year and welcome new attendees. Each attendee will receive one drink ticket for beer, wine, soda or bottled water. | URL: http://ire.org/events-and-training/event/1574/2083/",See printed schedule for room information,False
,IRE Conference Registration (Friday),2015-06-05,7:30 a.m.,2015-06-05,6:00:00 p.m.,False,Registration will be located on the 4th floor of the Philadelphia Marriott Downtown.&nbsp; | URL: http://ire.org/events-and-training/event/1574/2087/,Franklin Hall Foyer,False
,IRE Sales Table (Friday),2015-06-05,7:30 a.m.,2015-06-05,6:00:00 p.m.,False,"Stop by the IRE sales table and take a look at our merchandise. We will be selling books, the large selection of titles we carry will certainly include your interests. All proceeds from your purchase help support IRE and its mission. &nbsp;Sales will be located on the 4th floor of the Philadelphia Marriott Downtown. | URL: http://ire.org/events-and-training/event/1574/2090/",Franklin Hall Foyer,False
spreadsheets,Cleaning up data with OpenRefine,2015-06-05,9:00:00 a.m.,2015-06-05,10:00:00 a.m.,False,"Speakers: Kate Golden - Learn to take filthy, stinking, messy data from an unhelpful government agency and transform it into something useful with the help of OpenRefine. If you often have to scrub and standardize huge spreadsheets, but you haven't delved into regular expressions, this program will change your life. | URL: http://ire.org/events-and-training/event/1574/2020/",Room 404,False
,How to buy a candidate (Sponsored by Rockefeller Brothers Fund),2015-06-05,9:00:00 a.m.,2015-06-05,10:00:00 a.m.,False,"Speakers: Bill Allison, Edwin Bender, Russ Choma, Michael Beckel - **Moderated by Michael Beckel,&nbsp;The Center for Public Integrity | URL: http://ire.org/events-and-training/event/1574/1922/",Franklin 1&amp;2,False
,The year in investigative reporting,2015-06-05,9:00:00 a.m.,2015-06-05,10:00:00 a.m.,False,"Speakers: Jaimi Dowdell, Mark Horvit - Pick up some story ideas and be inspired with the highlights of some of the year's best investigations. | URL: http://ire.org/events-and-training/event/1574/1939/",Franklin 5&amp;6,False
,Broadcast: Investigative reporting at networks,2015-06-05,9:00:00 a.m.,2015-06-05,10:00:00 a.m.,False,"Speakers: Josh Mankiewicz, Ira Rosen, Rhonda Schwartz - What are the stories that matter for network TV and how do you go about getting them?&nbsp; | URL: http://ire.org/events-and-training/event/1574/1951/",Franklin 9&amp;10,False
,"Investigating economic development subsidies: Missing jobs, strained budgets and tense politics (Sponsored by Bloomberg)",2015-06-05,9:00:00 a.m.,2015-06-05,10:00:00 a.m.,False,"Speakers: Alejandra Cancino, Gordon Russell, Lee Zurik, Greg LeRoy - **Moderated by Greg LeRoy,&nbsp;Good Jobs First | URL: http://ire.org/events-and-training/event/1574/1963/",Salon C,False
,Mapping mini camp (pre-registration required),2015-06-05,9:00:00 a.m.,2015-06-05,6:00:00 p.m.,False,"Speakers: David Herzog, Jennifer LaFleur, Brian Peterson - Learn how to uncover interesting news stories by mapping data with geographic information system (GIS) software during our intensive mini-boot camp and receive a free copy of ArcGIS Desktop*.&nbsp; | URL: http://ire.org/events-and-training/event/1574/1892/",Room 402,False
,Geolocation for investigations,2015-06-05,9:00:00 a.m.,2015-06-05,10:00:00 a.m.,False,"Speakers: Jack Gillum, Jan Gunnar Furuly, Jennifer Peck - New tools are harnessing social media feeds and allowing you to tap into conversations around the world. In this panel, we'll look at specific tools like Banjo, Creepy and Instagram's API. We'll show examples of how geo-location tools are being used for investigations by The Associated Press and Aftenposten in Norway and show why geolocation can help your find sources faster so you can beef-up your coverage during breaking news. | URL: http://ire.org/events-and-training/event/1574/1984/",Salon E,False
,Wedgies: Social polling (Sponsored by Knight Foundation),2015-06-05,9:00:00 a.m.,2015-06-05,10:00:00 a.m.,False,Speakers: Porter Haney | URL: http://ire.org/events-and-training/event/1574/1921/,Franklin 7,False
,Management track: Managing the multi-newsroom project,2015-06-05,9:00:00 a.m.,2015-06-05,10:00:00 a.m.,False,"Speakers: John Kelly, Marina Walker Guevara, Richard Pienciak, Ellen Weiss - **Moderated by Ellen Weiss, Scripps Washington Bureau | URL: http://ire.org/events-and-training/event/1574/1936/",Franklin 3&amp;4,False
,The other half of the story: How reporters can use data to identify &#39;positive deviants&#39; and add fresh angles to investigative stories,2015-06-05,9:00:00 a.m.,2015-06-05,10:00:00 a.m.,False,"Speakers: Greg Borowski, David Bornstein, Tina Rosenberg, Claudia Rowe - Journalists normally use data to identify bad actors. But it's also worth looking at the positive deviants - &nbsp;those who are getting better than expected outcomes. Looking at how they got those results takes away the excuses of the poor performers and can make investigations into wrongdoing more powerful. The panelists are journalists or editors who will explain how they have used this approach to strengthen or reframe investigations.&nbsp; | URL: http://ire.org/events-and-training/event/1574/1972/",Salon D,False
,Show &amp; Tell (Friday - #1),2015-06-05,9:00:00 a.m.,2015-06-05,10:00:00 a.m.,False,"Speakers: Charlotte Huffman - **Moderated by Charlotte Huffman, KYW/CBS3 Philadelphia | URL: http://ire.org/events-and-training/event/1574/2065/",Franklin 8,False
spreadsheets,Excel 1: Getting started with spreadsheets,2015-06-05,9:00:00 a.m.,2015-06-05,10:00:00 a.m.,False,"Speakers: Jill Riepenhoff - In this introduction to spreadsheets you'll begin analyzing data with Excel, a simple but powerful tool. You'll learn how to enter data, sort it, filter it and conduct simple calculations like sum, average and median. | URL: http://ire.org/events-and-training/event/1574/2011/",Room 401,False
,Research independence day: Top 100 tips to liberate your searching,2015-06-05,10:10 a.m.,2015-06-05,11:10 a.m.,False,"Speakers: Barbara Gray, Margot Williams - Muckrakers will leave with a basket full of the latest tools and tricks for public records research, online privacy and advanced search techniques, alerting services and personal web caching and archiving. | URL: http://ire.org/events-and-training/event/1574/1986/",Salon E,False
spreadsheets,Excel 2: Functions and pivot tables,2015-06-05,10:10 a.m.,2015-06-05,11:10 a.m.,False,"Speakers: Meredith Broussard - In this class you'll learn how to use formulas to analyze data with the eye of a journalist using calculations like change, percent change and rates. It will also focus on the power of pivot tables for analysis in minutes rather than hours. | URL: http://ire.org/events-and-training/event/1574/2012/",Room 401,False
,Future threats: New avenues of investigative reporting in the fast-changing world of emerging global crises,2015-06-05,10:10 a.m.,2015-06-05,11:10 a.m.,False,"Speakers: Robert Eshelman, Deborah Nelson, Andrew Revkin, Josh Meyer - **Moderated by Josh Meyer, Medill National Security Journalism Initiative | URL: http://ire.org/events-and-training/event/1574/1965/",Salon C,False
,"Freelance reporting with impact: How stories get attention, and results (Sponsored by Fund for Investigative Journalism)",2015-06-05,10:10 a.m.,2015-06-05,11:10 a.m.,False,"Speakers: Isaiah Thompson, Hella Winston, Maria Zamudio, Sandra Bartlett - **Moderated by Sandra Bartlett, independent journalist | URL: http://ire.org/events-and-training/event/1574/1941/",Franklin 5&amp;6,False
,Backgrounding on deadline,2015-06-05,10:10 a.m.,2015-06-05,11:10 a.m.,False,"Speakers: Kate Martin, James Neff - Someone is suddenly swept into a news event: a train crash, a natural disaster, a police shooting. Who is s/he? What&rsquo;s their story? Find out what websites and other resources you should use to quickly unveil this person's past and present -- whether you have only 15 minutes, an hour, a day or the luxury of a week. Find undiscovered social-media accounts and court records, and learn new search-engine tricks, all on the cheap. | URL: http://ire.org/events-and-training/event/1574/1930/",Franklin 1&amp;2,False
,"Beyond Ferguson: Investigating schools, police and inequality (Sponsored by Temple University School of Media and Communication)",2015-06-05,10:10 a.m.,2015-06-05,11:10 a.m.,False,"Speakers: Nikole Hannah-Jones, Kimbriell Kelly, Frances Robles | URL: http://ire.org/events-and-training/event/1574/1944/",Salon D,False
,Under pressure: Real life in real time with breaking news,2015-06-05,10:10 a.m.,2015-06-05,11:10 a.m.,False,"Speakers: Stephen Stock - Come experience the real heart pounding excitement of a breaking news simulation where your investigative reporting and computer assisted reporting skills will be put through the ringer and to the test as teams compete to see who can break real, enterprise news in a minute by minute breaking news scenario. Sharpen your skills or learn new techniques to take back to your newsroom to help your team win the day the next time a big breaking news story happens in your backyard. This class can be useful to anyone from novice beginners to experienced internet jockeys. See how good your skills really are. | URL: http://ire.org/events-and-training/event/1574/2021/",Room 404,False
,Scripter: The story begins here... (Sponsored by Knight Foundation),2015-06-05,10:10 a.m.,2015-06-05,11:10 a.m.,False,"Speakers: Altaf Khatri - Come to the debut presentation of the world's first visual aggregated data repository. Scripter&rsquo;s platform provides the ability to collect, organize, plot, analyze and present your data (text, documents, photos, video and audio) on a stunning graphical story canvas. Scripter is where the &ldquo;Power of the Pen meets the Power of Technology.&rdquo; | URL: http://ire.org/events-and-training/event/1574/1998/",Franklin 7,False
,Broadcast: How to get people to talk,2015-06-05,10:10 a.m.,2015-06-05,11:10 a.m.,False,"Speakers: Scott Friedman, Keli Rabon, Scott Zamost - Whether it's a top official at the FBI or IRS, the Mormon Church or an accused sex offender, there are proven methods to persuade people to go on camera. We'll reveal the secrets behind landing the interview that no one thought would happen.&nbsp; | URL: http://ire.org/events-and-training/event/1574/1907/",Franklin 9&amp;10,False
,How reporters can best protect themselves and their sources,2015-06-05,10:10 a.m.,2015-06-05,11:10 a.m.,False,"Speakers: Ross Garber, Adam Goldman, Joel Kurtzberg, Mark MacDougall - How do you know if your story might trigger a lawsuit or a leak investigation? Should you keep your notes or throw them out? How much do you tell your editors? Your colleagues? What are best email practices? Do you know what is privilege and who owns it? Hear from top defense lawyers and a Pulitzer-Prize winning investigative reporter who have been embroiled in these toxic investigations.&nbsp; | URL: http://ire.org/events-and-training/event/1574/1937/",Franklin 3&amp;4,False
,Show &amp; Tell (Friday - #2),2015-06-05,10:10 a.m.,2015-06-05,11:10 a.m.,False,"Speakers: Jim Strickland - **Moderated by Jim Strickland, WSB-Atlanta | URL: http://ire.org/events-and-training/event/1574/2066/",Franklin 8,False
,Muckraking around the world,2015-06-05,11:20 a.m.,2015-06-05,12:20 p.m.,False,"Speakers: Dayo Aiyetan, Wahyu Dhyatmika, Jan Gunnar Furuly, Rana Sabbagh, David Kaplan - **Moderated by David Kaplan, Global Investigative Journalism Network | URL: http://ire.org/events-and-training/event/1574/1976/",Salon D,False
,Ethnography for journalists: Storytelling and the deep dive,2015-06-05,11:20 a.m.,2015-06-05,12:20 p.m.,False,"Speakers: Sarah Stillman, Paige Williams - This session explores the kind of deep-dive, immersive reporting that produces narratives as varied as Stillman's ""Where Are the Children?"" and Williams's ""The Tallest Trophy,"" both from recent issues of The New Yorker. Such storytelling requires an investment in people and place; it demands the kind of detailed, fly-on-the-wall reporting that Walt Harrington calls ""intimate journalism,"" and shares parallels with ethnography, the scientific description of how a community or culture lives. | URL: http://ire.org/events-and-training/event/1574/1938/",Franklin 3&amp;4,False
,Open records laws: Strategies for successful negotiations,2015-06-05,11:20 a.m.,2015-06-05,12:20 p.m.,False,"Speakers: Hannah Levintova, Joshua B. Pribanic, Carrie McGuire, Terry Mutchler - **Moderated by Carrie McGuire, Office of Government Information Services (OGIS) | URL: http://ire.org/events-and-training/event/1574/2100/",Salon C,False
,Internet site fingerprints: Looking for telltale signs that suggest connections between websites (Sponsored by Knight Foundation),2015-06-05,11:20 a.m.,2015-06-05,12:20 p.m.,False,"Speakers: Griff Palmer - A company presenting itself as a legitimate, global corporate citizen has been described to you by former insiders as an Internet fraud scheme. The former insiders have identified several Web sites that they say are part of the scheme, and have given you rock-solid evidence. Your sources tell you their confirmed sites are part of a much larger network. The company allegedly behind it all has a history of litigiousness, and has gone to great lengths to cover up its alleged ties to the fraudulent network. Griff Palmer will show how widely available Internet tools can help solidify such a story. | URL: http://ire.org/events-and-training/event/1574/1999/",Franklin 7,False
,"Adventures in the oil patch: Fracking, earthquakes and corporate influence",2015-06-05,11:20 a.m.,2015-06-05,12:20 p.m.,False,"Speakers: Ziva Branstetter, Lisa Song, Mike Soraghan - Join us for a wide-ranging discussion on watchdog stories you can do in your state tracking the influence and impact of the energy industry. We'll tell you how to report on induced earthquakes, spills, oilfield safety, pollution, weak regulation and corporate influence involving oil and gas operations. Whether you live in an oil or gas producing state or not, your readers and viewers are impacted by these issues and we'll tell you how to frame them.&nbsp; | URL: http://ire.org/events-and-training/event/1574/1943/",Franklin 5&amp;6,False
,Show &amp; Tell (Friday - #3),2015-06-05,11:20 a.m.,2015-06-05,12:20 p.m.,False,"Speakers: Kevin Keeshan - **Moderated by Kevin Keeshan, NBCUniversal Owned Television Stations | URL: http://ire.org/events-and-training/event/1574/2067/",Franklin 8,False
,Broadcast: Visual video toolbox,2015-06-05,11:20 a.m.,2015-06-05,12:20 p.m.,False,"Speakers: Jeremy Jojola, Bryan Staples, Evan Stulberger - You've got a great story. A real blockbuster. Just one problem. There's. No. Video. | URL: http://ire.org/events-and-training/event/1574/1954/",Franklin 9&amp;10,False
,Investigating the justice system (Sponsored by Criminal Justice Journalists),2015-06-05,11:20 a.m.,2015-06-05,12:20 p.m.,False,"Speakers: John Hollway, Beth Hundsdorfer, George Pawlaczyk, John Roman, Douglas Starr, Ted Gest - **Moderated by Ted Gest, Criminal Justice Journalists | URL: http://ire.org/events-and-training/event/1574/1931/",Franklin 1&amp;2,False
spreadsheets,Getting data into Excel,2015-06-05,11:20 a.m.,2015-06-05,12:20 p.m.,False,"Speakers: Patti DiVincenzo - Don't let hard-to-use data ruin your day. Learn how to import a variety of formats (such as text files, HTML tables, PDFs) into Excel. | URL: http://ire.org/events-and-training/event/1574/2014/",Room 401,False
,Finding the story: Bridge inspections,2015-06-05,11:20 a.m.,2015-06-05,12:20 p.m.,False,"Speakers: Liz Lucas - Every state has bridges: how safe are yours? This is a question that appeals to everyone (we all drive and/or walk on bridges), and the National Bridge Inventory can help you answer it. In this session we'll dive into the data for Pennsylvania, discuss additional sources, and sketch out stories that work in every city. ​To get the most from this session, you should have some experience working with data in spreadsheets. | URL: http://ire.org/events-and-training/event/1574/2022/",Room 404,False
,"Sexual assault investigations: Empathy, accuracy, transparency (Sponsored by Dart Center for Journalism &amp; Trauma)",2015-06-05,11:20 a.m.,2015-06-05,12:20 p.m.,False,"Speakers: Teresa Braeckel, Sheila Coronel, Steve Coll, Elana Newman, Nicole Noren, Bruce Shapiro - **Moderated by Bruce Shapiro, Dart Center for Journalism &amp; Trauma | URL: http://ire.org/events-and-training/event/1574/1989/",Salon E,False
,Lunch on your own (Friday),2015-06-05,12:30 p.m.,2015-06-05,2:30 p.m.,False,Speakers: TBA | URL: http://ire.org/events-and-training/event/1574/2096/,See printed schedule for room information,False
,Media lawyers brown bag,2015-06-05,12:45 p.m.,2015-06-05,2:00:00 p.m.,False,"Speakers: Frank LoMonte, Amy Ginensky, Terry Mutchler - Does your investigation contain complex legal questions? Unsure of how to proceed? During the media lawyers brown bag, between 12:45 and 2 p.m. on Friday, June 5, bring your lunch and your questions for a personal discussion with some prominent media law experts that will be presenting throughout the 2015 IRE Conference. We'll provide drinks and dessert. | URL: http://ire.org/events-and-training/event/1574/2093/",Franklin 3&amp;4,False
,Getting started with R,2015-06-05,2:30 p.m.,2015-06-05,3:30 p.m.,False,"Speakers: Ryann Grochowski Jones - Add statistical heft to your reporting by using R, a free, powerful open-source programming language. This session will tackle the basics of R: importing data, installing packages, working with variables, and sorting and organizing your data.&nbsp; | URL: http://ire.org/events-and-training/event/1574/2016/",Room 401,False
,Interviewing liars,2015-06-05,2:30 p.m.,2015-06-05,3:30 p.m.,False,"Speakers: Matt Apuzzo, Don Borelli, Barry McManus - An investigative reporter, a former CIA polygraphist, and an FBI counterterrorism agent give you the tools you need for any interview. Learn how the FBI prepares for an interview and how intelligence professionals build rapport with people who have no incentive to talk. How can you tell when you're being lied to? How should you respond when it happens? And find out how to keep people talking, even when they know they should not. | URL: http://ire.org/events-and-training/event/1574/1990/",Salon E,False
,Covering the economics of medicine (Sponsored by Bloomberg),2015-06-05,2:30 p.m.,2015-06-05,3:30 p.m.,False,"Speakers: Dean Baker, David Cay Johnston, Alicia Mundy - With healthcare costing 17.4 percent of the economy, knowing who gets the money, why we spend twice the average of other rich countries and how to think about cost issues can be valuable in identifying stories. Two journalists who have long reported on health care economics and an economist who has written extensively on how patent law and trade policies drive up health care costs will show you the data and suggest ways to think about the issues. | URL: http://ire.org/events-and-training/event/1574/1967/",Salon C,False
,Broadcast deep dives 2,2015-06-05,2:30 p.m.,2015-06-05,3:30 p.m.,False,"Speakers: Vicky Nguyen, Liz Wagner, Jim Strickland, Tisha Thompson, Rick Yarborough - From undercover and interview techniques to research and records requests, watch some of the best investigative stories of the year and hear from the journalists behind the work. | URL: http://ire.org/events-and-training/event/1574/2007/",Franklin 8,False
,20 tools to fortify your social media,2015-06-05,2:30 p.m.,2015-06-05,3:30 p.m.,False,"Speakers: Doug Haddix - Whether you&rsquo;re a social media novice or sophisticate, you&rsquo;ll discover new tools and tactics with these proven apps and websites. Most are free or low cost. Tame Twitter with apps to help you find sources, uncover connections and mine posts. Discover ways to find social posts by location to target specific neighborhoods or communities for sources and information. Learn about simple tools to make compelling charts, maps, and other visuals to make your posts more shareable and engaging. Find ways to manage the social media firehose with automated curation, scheduled posts and effective monitoring. | URL: http://ire.org/events-and-training/event/1574/1932/",Franklin 1&amp;2,False
,Funding the independent investigation (Sponsored by Fund for Investigative Journalism),2015-06-05,2:30 p.m.,2015-06-05,3:30 p.m.,False,"Speakers: Esther Kaplan, Jane Sasseen, Ricardo Sandoval-Palos, Jon Sawyer, Laird Townsend, Brant Houston - **Moderated by Brant Houston, University of Illinois | URL: http://ire.org/events-and-training/event/1574/1978/",Salon D,False
,Broadcast: Avoiding legal trouble,2015-06-05,2:30 p.m.,2015-06-05,3:30 p.m.,False,"Speakers: Steve Chung, Barbara Wall, Kathleen Johnston - **Moderated by Kathleen Johnston, independent journalist | URL: http://ire.org/events-and-training/event/1574/1956/",Franklin 9&amp;10,False
