Topic,Subject,Start Date,Start Time,End Date,End Time,All Day Event,Description,Location,Private,Pop-up panel (TBA #1),6/6/15,4:50 p.m.,6/6/15,5:50 p.m.,FALSE,Speakers: TBA | URL: http://ire.org/events-and-training/event/1574/2026/,Franklin 1&amp;2,FALSE,Pop-up panel (TBA #2),6/6/15,4:50 p.m.,6/6/15,5:50 p.m.,FALSE,Speakers: TBA | URL: http://ire.org/events-and-training/event/1574/2027/,Franklin 3&amp;4,FALSE,Investigations with DocumentCloud,6/6/15,4:50 p.m.,6/6/15,5:50 p.m.,FALSE,"Speakers: Anthony DeBarros, Ted Han - Learn how to make the most of DocumentCloud&rsquo;s search, annotation, collaboration and publishing tools for your next investigation. Plus we&rsquo;ll show great examples of DocumentCloud in action in recent investigative reports. This will be a focused hour of great examples of DocumentCloud in action and the particular pieces of the platform that investigations can make use of. | URL: http://ire.org/events-and-training/event/1574/2040/",Room 401,FALSE,Pop-up panel (TBA #3),6/6/15,4:50 p.m.,6/6/15,5:50 p.m.,FALSE,Speakers: TBA | URL: http://ire.org/events-and-training/event/1574/2028/,Franklin 5&amp;6,FALSE,Using data to explore violence in Latin American Communities,6/6/15,4:50 p.m.,6/6/15,5:50 p.m.,FALSE,"Speakers: Ricardo Alanis Tamez, Ana Arana, Claudia Nunez, Ricardo Sandoval-Palos - **Moderated by Ricardo Sandoval-Palos, NPR | URL: http://ire.org/events-and-training/event/1574/2004/",Room 414/415,FALSE,Pop-up panel (TBA #4),6/6/15,4:50 p.m.,6/6/15,5:50 p.m.,FALSE,Speakers: TBA | URL: http://ire.org/events-and-training/event/1574/2114/,Salon G,FALSE,Surviving PDFs: Tools and techniques (Sponsored by Knight Foundation),6/6/15,4:50 p.m.,6/6/15,5:50 p.m.,FALSE,"Speakers: Ryann Grochowski Jones, Tom Torok | URL: http://ire.org/events-and-training/event/1574/2006/",Franklin 7,FALSE,Data deep dives: Philip Meyer Award winners,6/6/15,4:50 p.m.,6/6/15,5:50 p.m.,FALSE,"Speakers: David Donald, Michael Grabell, Ryan McNeill, Joseph Neff - **Moderated by Joseph Neff, The News &amp; Observer | URL: http://ire.org/events-and-training/event/1574/2001/",Salon K/L,FALSE,Twitter tricks and analytics,6/6/15,4:50 p.m.,6/6/15,5:50 p.m.,FALSE,"Speakers: Doug Haddix - If you know the basics of Twitter, you're ready to ratchet up your skills. This hands-on session will take you to the next level: advanced Twitter searches, mining tweets by location, creative uses of Twitter lists (public and private), and apps/services that provide robust analytics. The payoff: better sources (particularly during breaking news) and a competitive edge in your market. | URL: http://ire.org/events-and-training/event/1574/2055/",Room 404,FALSE,Closing reception,6/6/15,7:00:00 p.m.,6/6/15,8:15 p.m.,FALSE,"Join us for a closing reception from 7 - 8:15 p.m. and enjoy one last evening of catching up with old and new friends, speakers and colleagues. &nbsp; | URL: http://ire.org/events-and-training/event/1574/2084/","Salon C-D, E",FALSE,IRE Sales Table (Sunday),6/7/15,8:30 a.m.,6/7/15,10:30 a.m.,FALSE,"Stop by the IRE sales table and take a look at our merchandise. We will be selling books, the large selection of titles we carry will certainly include your interests. All proceeds from your purchase help support IRE and its mission. &nbsp;Sales will be located on the 4th floor of the Philadelphia Marriott Downtown. | URL: http://ire.org/events-and-training/event/1574/2092/",Franklin Hall Foyer,FALSE,"Whose truth? Evaluate experts, recognize junk, tell better science &amp; environmental stories",6/7/15,9:00:00 a.m.,6/7/15,12:20 p.m.,FALSE,Speakers: Elissa Yancey - Want to find new ways to make your audience hungry for science and environmental stories? Then come to a three-hour workshop that helps you sift through the science and the anti-science and gives you practical ideas to help you ramp up your science and environmental storytelling. | URL: http://ire.org/events-and-training/event/1574/2111/,Franklin 9&amp;10,FALSE,Data and docs,6/7/15,9:00:00 a.m.,6/7/15,10:00:00 a.m.,FALSE,"Speakers: Megan Luther - Move beyond anecdotes and he-said, she-said journalism with data and documents. Advice on developing a documents state of mind, navigating public records, understanding records retention schedules, exploring key records on a variety of beats, and becoming familiar with key data sets to produce high-impact local stories. | URL: http://ire.org/events-and-training/event/1574/2009/",Franklin 3&amp;4,FALSE,Web scraping for anyone (repeat session),6/7/15,9:00:00 a.m.,6/7/15,10:00:00 a.m.,FALSE,Speakers: Matt Wynn | URL: http://ire.org/events-and-training/event/1574/2056/,Room 404,FALSE,Get the IRE edge,6/7/15,9:00:00 a.m.,6/7/15,10:00:00 a.m.,FALSE,"Speakers: Alex Richards, Lauren Grandestaff, Sarah Hutchins | URL: http://ire.org/events-and-training/event/1574/2113/",Franklin 7,FALSEspreadsheets,Advanced Excel functions (repeat session),6/7/15,9:00:00 a.m.,6/7/15,10:00:00 a.m.,FALSE,Speakers: Liz Lucas | URL: http://ire.org/events-and-training/event/1574/2041/,Room 401,FALSE,The Web for investigators,6/7/15,9:00:00 a.m.,6/7/15,10:00:00 a.m.,FALSE,"Speakers: Mark Horvit - What reporters and editors need to know. From better search techniques to the invisible Web, how to find documents and databases on deadline and where to find reliable websites for enterprise stories. The craft of better searching and not wasting time. Handling issues of credibility and ethics online. | URL: http://ire.org/events-and-training/event/1574/2008/",Franklin 1&amp;2,FALSE,"Science journalism: Finding stories, choosing sources, sharing truth &amp; other uncertainties",6/7/15,9:00:00 a.m.,6/7/15,12:20 p.m.,FALSE,Speakers: TBA | URL: http://ire.org/events-and-training/event/1574/2010/,Franklin 9&amp;10,FALSE,Using hypotheses: The core of investigative method,6/7/15,10:10 a.m.,6/7/15,11:10 a.m.,FALSE,"Speakers: Luuk Sengers - In Story-Based Inquiry, an investigation begins with a hypothesis. This is an answer to the question &ldquo;What do you think that happened?&rdquo; In this session participants will learn to explore possible story angles, and to rephrase them as concrete events that can be verified. Knowing what you are looking for increases your chances of discovering it. A hypothesis also makes it easier to co-operate in a team and to &ldquo;sell&rdquo; an idea to editors or clients. | URL: http://ire.org/events-and-training/event/1574/2107/",Franklin 3&amp;4,FALSEspreadsheets,Cleaning up data with OpenRefine (repeat session),6/7/15,10:10 a.m.,6/7/15,11:10 a.m.,FALSE,Speakers: Denise Malan | URL: http://ire.org/events-and-training/event/1574/2057/,Room 404,FALSE,Finding the story: Workplace safety,6/7/15,10:10 a.m.,6/7/15,11:10 a.m.,FALSE,Speakers: Jaimi Dowdell | URL: http://ire.org/events-and-training/event/1574/2042/,Room 401,FALSE,Career roundtable,6/7/15,10:10 a.m.,6/7/15,11:10 a.m.,FALSE,"Speakers: David Cay Johnston, Ellen Gabler, Manny Garcia, Josh Meyer, Jill Riepenhoff, Stephen Stock, Nicole Vap, Mark Horvit - **Moderated by Mark Horvit, IRE/NICAR | URL: http://ire.org/events-and-training/event/1574/2106/",Franklin 1&amp;2,FALSEcommand line,Command line fundamentals for journalists,6/7/15,11:20 a.m.,6/7/15,12:20 p.m.,FALSE,Speakers: Alex Richards | URL: http://ire.org/events-and-training/event/1574/2058/,Room 404,FALSE,Liberating data from PDFs (repeat session),6/7/15,11:20 a.m.,6/7/15,12:20 p.m.,FALSE,Speakers: David Herzog | URL: http://ire.org/events-and-training/event/1574/2043/,Room 401,FALSE,Investigating fraud,6/7/15,11:20 a.m.,6/7/15,12:20 p.m.,FALSE,"Speakers: Roddy Boyd - Proving corporate fraud is usually the work of a judge and jury but the indicators of looming migraines, especially for publicly traded companies, are almost always found in ""plain sight,"" within the public legal and financial filings. Armed with nearly unimpeachable source documents--i.e. what corporate executives have personally signed off on--your reporting on publicly traded companies can be instantly transformed into something much deeper and relevant. | URL: http://ire.org/events-and-training/event/1574/2015/",Franklin 1&amp;2,FALSE,Mastering timelines: The royal road to a successful project,6/7/15,11:20 a.m.,6/7/15,12:20 p.m.,FALSE,"Speakers: Luuk Sengers - In Story-Based Inquiry, the hypothesis accounts for the principal event. But something must have happened first, to make that event possible. And after the event occurs, there will be further events and consequences. In this session participants will learn how to use their imaginations to construct a hypothetical chain of events (timeline or scenario), which can be used to guide investigators toward sources and documents with a high degree of accuracy. | URL: http://ire.org/events-and-training/event/1574/2108/",Franklin 3&amp;4,FALSE,DocumentCloud: Examples and suggestions (Sponsored by Knight Foundation),6/7/15,11:20 a.m.,6/7/15,12:20 p.m.,FALSE,"Speakers: Ted Han, Anthony DeBarros | URL: http://ire.org/events-and-training/event/1574/2017/",Franklin 7,FALSE