Topic,Subject,Start Date,Start Time,End Date,End Time,Speaker(s),Description,Location,URL
,(More than) 10 data sources you may never have heard of (Hosted by Donald W. Reynolds National Center for Business Journalism),2017-06-21,2:00 p.m.,2017-06-21,5:00 p.m.,Steve Doig,"Data journalist Stephen Doig, professor at Arizona State University's Walter Cronkite School of Journalism and Mass Communication, who served as the longtime Knight Chair in Journalism at Cronkite, presents “(More Than) 10 Data Sources You May Never Have Heard Of.” This pre-conference workshop, sponsored by the Donald W. Reynolds National Center for Business Journalism, will be held on Wednesday, June 21 from 2-5 p.m.
Rich business and financial databases are everywhere, and smart reporters on almost any beat will find these useful. From ZIP code-level business patterns and foreign trade imports to property tax rolls and professional licenses, Doig will walk you through seldom-used databases that hold treasures for reporters. You'll learn what's in the data sets, how to get them, what you can pull from them, what questions to ask of the data and story ideas that could be developed. You'll leave armed with new knowledge and fresh ideas. Doig's original “10 Data Sources” presentation at IRE 2016 drew a capacity crowd.
Reserve your space in this workshop here.
",Grand Sonoran F,http://ire.org/events-and-training/event/2703/3193/
,IRE Conference Sales (Wednesday),2017-06-21,2:00 p.m.,2017-06-21,6:00 p.m.,TBA,"Stop by the IRE Conference sales table and browse our merchandise, including the IRE bookstore's most popular titles and shirts.
",Grand Sonoran F Foyer,http://ire.org/events-and-training/event/2703/3425/
,IRE Conference Registration (Wednesday),2017-06-21,2:00 p.m.,2017-06-21,6:00 p.m.,TBA,,East registration desk,http://ire.org/events-and-training/event/2703/3370/
,IRE Conference Sales (Thursday),2017-06-22,7:30 a.m.,2017-06-22,6:00 p.m.,TBA,"Stop by the IRE Conference sales table and browse our merchandise, including the IRE bookstore's most popular titles and shirts.
",Grand Sonoran F Foyer,http://ire.org/events-and-training/event/2703/3426/
,IRE Conference Registration (Thursday),2017-06-22,7:30 a.m.,2017-06-22,6:00 p.m.,TBA,,East registration desk,http://ire.org/events-and-training/event/2703/3371/
,Following the money (Sponsored by Bloomberg),2017-06-22,9:00 a.m.,2017-06-22,10:00 a.m.,"Alexandra Berzon, Ashley Balcerzak, David Heath","Often, the key to cracking open a story is to track down the money behind the decisions. This panel will look at how to map out business empires, teach you money-in-politics tricks and reveal how industry can use its influence to direct policy and even public opinion.
",Grand Canyon 7,http://ire.org/events-and-training/event/2703/3197/
spreadsheets,Excel 1: Getting started with spreadsheets,2017-06-22,9:00 a.m.,2017-06-22,10:00 a.m.,Aimee Edmondson,"In this introduction to spreadsheets you'll begin analyzing data with Excel, a simple but powerful tool. You'll learn how to enter data, sort it, filter it and conduct simple calculations like sum, average and median.
",Pinnacle Peak 2,http://ire.org/events-and-training/event/2703/3328/
,Exhibitors & Recruiters (Thursday),2017-06-22,9:00 a.m.,2017-06-22,5:00 p.m.,TBA,"Stop by and visit with exhibitors and recruiters during the 2017 IRE Conference.  A list of those attending is here.
",Grand Canyon Foyer,http://ire.org/events-and-training/event/2703/3430/
,Best of broadcast  (Sponsored by National Association of Broadcasters),2017-06-22,9:00 a.m.,2017-06-22,10:00 a.m.,"Lee Zurik, Jon Turnipseed","Watch and listen as the photographers, editors, reporters and producers behind this year's IRE Award winners and finalists explain how they did it, what they would do differently and what they were really thinking when things got hard.
",Grand Sonoran G,http://ire.org/events-and-training/event/2703/3296/
,Show & Tell *Thursday #1 (Sponsored by Napoli Management Group),2017-06-22,9:00 a.m.,2017-06-22,10:00 a.m.,Patti Dennis,"**Moderated by Patti Dennis, TEGNA Inc.
Show & Tell sessions allow you to share your investigations with colleagues from around the country. Veteran broadcasters will moderate each session. Each slot runs for 15 minutes.
Reserve a slot online: Thursday sign-ups open at 9 a.m. on Wednesday.
",Grand Sonoran B-D,http://ire.org/events-and-training/event/2703/3377/
,Prisons and jails (Sponsored by Criminal Justice Journalists),2017-06-22,9:00 a.m.,2017-06-22,10:00 a.m.,"Amy Brittain, Ted Gest, Magnus Lofstrom, Paige St. John","**Moderated by Ted Gest, Criminal Justice Journalists
An expert and journalists who cover prison issues will tell you how to evaluate criminal justice ""reforms."" How can you obtain usable data and find information on a range of cases to interest readers and viewers? And how can you tell your audience whether a fix to the system is effective and protecting the public? We'll talk about examples across the country, from California's answer to prison crowding to Washington, D.C.'s ""second chance"" law for youth.
",Grand Canyon 4-5,http://ire.org/events-and-training/event/2703/3274/
,Exhibitor/Recruiter Hours (Thursday),2017-06-22,9:00 a.m.,2017-06-22,5:00 p.m.,TBA,,Foyer - 1st floor meeting space,http://ire.org/events-and-training/event/2703/3374/
,Investigating the tech industry,2017-06-22,9:00 a.m.,2017-06-22,10:00 a.m.,"Marcus Baram, Christina Farr, Yunan Zhang","**Moderated by Marcus Baram, Fast Company
The giant companies at the heart of the digital economy - Apple, Facebook, Amazon, Google - play an increasingly outsized role in our life and society, spurring an increase in coverage of the sector. But reporting on Silicon Valley can be uniquely challenging, from dealing with a secretive corporate culture to understanding complex technological developments. This panel will address these issues, with reporters discussing how they have managed to develop sources and break important stories.
",Grand Canyon 8,http://ire.org/events-and-training/event/2703/3198/
tableau,Interactive data graphics in Tableau Public (Hosted by Tableau),2017-06-22,9:00 a.m.,2017-06-22,10:30 a.m.,Ben Jones,"Learn how to create beautiful, interactive data visualizations on short deadlines. No programming required. You'll learn everything you need to build data visualizations and publish them to your website just like a video. We'll teach you how to:
Tableau Public is a free tool for journalists. No previous experience with Tableau is necessary to take this class. Laptops will be provided. This is a free training, however you must be registered for the IRE Conference to attend this class.  Limited seats are available.  There may be a few seats available on-site.
",Pinnacle Peak 1,http://ire.org/events-and-training/event/2703/3334/
,Sourcing people of color: Going beyond the community leader (Sponsored by NABJ Region III),2017-06-22,9:00 a.m.,2017-06-22,10:00 a.m.,"Manny Garcia, Diego Santiago, Maria Polletta, Warren Trent","In this session, we'll discuss and exchange ideas about the delicate yet important manner in which investigative journalists -- and media in general -- interact and deal with issues pertaining to the growing minority community.
",Grand Canyon 9-10,http://ire.org/events-and-training/event/2703/3404/
maps,Map camp: QGIS *pre-registration required,2017-06-22,9:00 a.m.,2017-06-22,6:00 p.m.,"Jennifer LaFleur, Charles Minshew","Learn how to uncover interesting news stories by mapping data with geographic information system (GIS) software during our intensive mini-boot camp.
Our trainers will teach you how to use QGIS, a powerful, free and open-source GIS software that runs on a Mac or a PC. QGIS can be used in your news organization's workflow to create maps for print, online and broadcast. You will learn how to display data geographically; import and query data; and geocode addresses to merge databases with maps. 
In addition, we'll provide you with our boot camp materials to help keep you on track long after you leave the conference.
Preregistration is required and seating is limited. Laptops will be provided for the training.
Workshop prerequisites: Participants should have basic knowledge in using relational database programs such as Microsoft Access, MySQL or SQLite.
NOTE: Registration is required for this session. Click here to sign up.
",Pinnacle Peak 3,http://ire.org/events-and-training/event/2703/3186/
,Welcome first-timers: Get a button and conference tips,2017-06-22,9:00 a.m.,2017-06-22,10:00 a.m.,"Doug Haddix, Cody Winchester, Megan Luther","Welcome to the conference! Get a special button for first-time attendees and hear from IRE staff about tips and tactics to navigate our conference like a pro. Also, you'll learn about key resources that IRE offers once you're back home.
",Grand Canyon 1-3,http://ire.org/events-and-training/event/2703/3194/
,What's up with LinkedIn?: Navigating the latest changes  (Sponsored by Knight Foundation),2017-06-22,9:00 a.m.,2017-06-22,10:00 a.m.,Jim Oberman,"Have you been frustrated with the recent changes to LinkedIn Premium and the removal of the “past not current” filter? Come discuss the recent changes and learn about workarounds to get what you need. Hear what LinkedIn is telling us about the reasons the filter was removed and what's up next for the platform. We'll demo some cool apps to use in conjunction with LinkedIn to help find emails and phone numbers.
",Grand Canyon 11-13,http://ire.org/events-and-training/event/2703/3312/
,The person on the other end of the phone: Working with corporate communicators during a crisis,2017-06-22,9:00 a.m.,2017-06-22,10:00 a.m.,"Seth Lubove, Mark Hass,","**Moderated by Mark Hass, ASU Walter Cronkite School of Journalism
Strategic communicators are key players when an organization is facing a crisis. What are the best techniques to have a working relationship with these professionals? What guidelines and principles are framing their work? This session is designed to help reporters understand the demands on strategic communicators during a crisis and how to work with them effectively.
",Grand Canyon 6,http://ire.org/events-and-training/event/2703/3196/
,Investigating inequality (Sponsored by Ida B. Wells Society),2017-06-22,10:15 a.m.,2017-06-22,11:15 a.m.,"Ron Nixon, Nikole Hannah-Jones","Learn about useful datasets, documents and reporting tips for covering racial disparities and discrimination in housing, education and law enforcement, among other things.
",Grand Canyon 9-10,http://ire.org/events-and-training/event/2703/3401/
,Broadcast: State of the state  (Sponsored by National Association of Broadcasters),2017-06-22,10:15 a.m.,2017-06-22,11:15 a.m.,"Kevin Keeshan, Mark Greenblatt, Sandy Breland, Ellen Crooke, Sean McLaughlin","**Moderated by Mark Greenblatt, Scripps Washington Bureau
“State of the State” is a first-of-its-kind, can't-miss panel that gathers senior executives from four of the nation's top broadcasting and digital news companies to discuss the current and future state of investigative reporting in America. You will get a chance to hear what makes their companies unique with respect to investigative reporting. There will be plenty of time for a moderated Q&A and audience questions. 
",Grand Sonoran G,http://ire.org/events-and-training/event/2703/3297/
spreadsheets,Excel 2: Functions and pivot tables,2017-06-22,10:15 a.m.,2017-06-22,11:15 a.m.,Nick Penzenstadler,"In this class you'll learn some snappy functions to help you ask questions of your data in Excel in minutes rather than hours. We'll focus on when and how to use functions, calculate rates and change and then use the power of pivot tables to ask questions like “Which groups have most?” or “How often does this happen?”
Prerequisites: This class will be helpful if you've taken Excel 1 or have worked with spreadsheets. We'll assume you can load data into Excel and get it relatively clean.
",Pinnacle Peak 2,http://ire.org/events-and-training/event/2703/3329/
,Setting PDF data free with Cometdocs (Sponsored by Knight Foundation),2017-06-22,10:15 a.m.,2017-06-22,11:15 a.m.,Reena Cruz,"This demo session takes a look at Cometdocs.com, the PDF conversion service. We'll take a look at the online, mobile and desktop platforms of the service with a focus on best practices, from basic workarounds to efficient PDF conversion tips. Our aim for this session is to help IRE members get the most out of their subscription account and the conversion service. Monthly subscription accounts are available for free to all IRE members as part of their membership; however, it is not mandatory to have one to attend and follow along with the demo.
",Grand Canyon 11-13,http://ire.org/events-and-training/event/2703/3314/
,Show & Tell *Thursday #2 (Sponsored by Napoli Management Group),2017-06-22,10:15 a.m.,2017-06-22,11:15 a.m.,Lana Durban Scott,"**Moderated by Lana Durban Scott, The E.W. Scripps Co.
Show & Tell sessions allow you to share your investigations with colleagues from around the country. Veteran broadcasters will moderate each session. Each slot runs for 15 minutes. 
Reserve a slot online: Thursday sign-ups open at 9 a.m. on Wednesday.
",Grand Sonoran B-D,http://ire.org/events-and-training/event/2703/3378/
,Digging into nonprofits,2017-06-22,10:15 a.m.,2017-06-22,11:15 a.m.,"Susan Batt, Brad Racino, Katie Rusnock","There are more than 1.5 million nonprofits spread across the U.S., including public charities, private foundations and other types such as chambers of commerce. These organizations are involved in a variety of industries including education, government, the environment, health and any other topic a typical reporter may cover in their day-to-day beat. Most nonprofits are required to file detailed statements — called 990s — that publicly disclose a large amount of information about the organization. 
",Grand Canyon 4-5,http://ire.org/events-and-training/event/2703/3200/
,Arizona Project Legacy: Protecting journalists from new threats,2017-06-22,10:15 a.m.,2017-06-22,11:15 a.m.,"Mark Monday, Tom Liffiton","Journalists face a myriad of threats as they pursue truth in dangerous places with dangerous people. Protecting information and sources -- as well as yourself -- can be complicated, and a journalist must think like a spymaster. We will examine cases from journalism, business espionage and the world of counterintelligence to identify some best practices.
",Grand Canyon 7,http://ire.org/events-and-training/event/2703/3230/
,Year in investigations,2017-06-22,10:15 a.m.,2017-06-22,11:15 a.m.,"Doug Haddix, Megan Luther","Pick up some story ideas and be inspired with the highlights of some of the year's best investigations.
",Grand Canyon 1-3,http://ire.org/events-and-training/event/2703/3199/
,Mastering the investigative interview,2017-06-22,10:15 a.m.,2017-06-22,11:15 a.m.,Julian Sher,"We've all done it -- blown a key interview or missed a vital question. We do them every day, often without thinking. Maybe that's the problem: Even as pros, we make basic mistakes in interviews because we're not thinking strategically and tactically. Politicians, businesspeople and PR flacks are experts at jumping on the smallest opening we give them, the tiniest mistake in formulating a question. It's not just about getting the facts. It's also about how to dramatically rethink the way you approach interviews, master the basic rules of tough interviews, and then learn how to break them when needed.
",Grand Canyon 6,http://ire.org/events-and-training/event/2703/3201/
,IRE Commons: How to enter the IRE Awards,2017-06-22,10:15 a.m.,2017-06-22,11:15 a.m.,"Lauren Grandestaff, Jill Riepenhoff","Learn how to make your IRE Awards entry stand out from the pack with tips from IRE's contest manager and contest committee chair. We'll talk about what to highlight to make your entry shine, what you should and shouldn't include, and best practices for filling out that pesky (but useful!) questionnaire.
",IRE Commons,http://ire.org/events-and-training/event/2703/3392/
,Examining hospitals: From finances to lawsuits (Sponsored by Bloomberg),2017-06-22,10:15 a.m.,2017-06-22,11:15 a.m.,"Sarah Jane Tribble, Cheryl W. Thompson, Karen Bouffard","This session will show you what documents to obtain to investigate public and private hospitals, including Medicare and accreditation data, 990s, and inspection records. Panelists also will  offer tips on how to find stories in the data.
",Grand Canyon 8,http://ire.org/events-and-training/event/2703/3203/
tableau,Show where the story is happening with maps in Tableau Public (Hosted by Tableau),2017-06-22,11:00 a.m.,2017-06-22,12:30 p.m.,Jenny Richards,"Maps are where it's at, and with the addition of spatial file support you can viz outside the box too. In this session you will learn different methods for building maps in Tableau Public. We will teach you how to:
Tableau Public is a free tool for journalists. Some familiarity with the product is recommended; a beginner session earlier in the day should prepare you enough for this session. Laptops will be provided. This is a free training, however you must be registered for the IRE Conference to attend this class.  Limited seats are available.  There may be a few seats available on-site.
 
",Pinnacle Peak 1,http://ire.org/events-and-training/event/2703/3335/
,Research Oasis (Sponsored by Knight Foundation),2017-06-22,11:30 a.m.,2017-06-22,12:30 p.m.,"Barbara Gray, Gary Price","Replenish your thirsty research skills at the Research Oasis, where Barbara Gray from CUNY J-School and Gary Price from Library Journal's INFOdocket, offer up the the latest methods and machines for all things investigative research.
",Grand Canyon 11-13,http://ire.org/events-and-training/event/2703/3316/
,Management: Why won't you just do what I want? Fixing the reporter-editor relationship,2017-06-22,11:30 a.m.,2017-06-22,12:30 p.m.,"Andrew Donohue, Lynn Walsh, Alison Young, Mark Horvit","**Moderated by Mark Horvit, University of Missouri
So, you don't get along with your editor.
So, you simply can't get that reporter to DO WHAT YOU WANT.
Relax. Our panel of veterans from both sides of the equation will help you with tips, suggestions and strategies to manage up, manage down, and generally make the whole process work. (At least, most of the time).
",Grand Canyon 1-3,http://ire.org/events-and-training/event/2703/3204/
spreadsheets,Excel 3: Advanced tools,2017-06-22,11:30 a.m.,2017-06-22,12:30 p.m.,Danielle Cervantes,"Whether you want to broaden your existing Excel skills or practice what you just learned in Excel 2, we'll show you how to employ advanced functions and construct more sophisticated pivot tables to boost your analysis and reporting. This session will feature federal contracting data for the state of Arizona in FY 2016.
",Pinnacle Peak 2,http://ire.org/events-and-training/event/2703/3330/
,"Storytelling that hums: What investigative reporters can learn from song, film, fiction & art",2017-06-22,11:30 a.m.,2017-06-22,12:30 p.m.,"Ken Armstrong, Louise Kiernan","Ways to enhance our writing can be found all around us – in the films we watch, the fiction we read, the podcast sagas we lose our weekends to, the song lyrics we know by heart, the images that catch our eye. Storytelling is an art with many a master. We'll look at what we can learn from the likes of Dolly Parton, Colson Whitehead, Jennifer Egan, Patty Griffin, Johnny Cash, Cormac McCarthy, Kerry James Marshall, Taryn Simon, Errol Morris, Ira Glass …
",Grand Canyon 8,http://ire.org/events-and-training/event/2703/3208/
,Broadcast: Deep dive I  (Sponsored by National Association of Broadcasters),2017-06-22,11:30 a.m.,2017-06-22,12:30 p.m.,"Eric Flack, Brian Ross, Rhonda Schwartz, Stephen Stock","Award-winning investigative journalists explain how they produced big projects for broadcast and online. Journalists will show their investigations and take you through them step-by-step, from story tip to finished product.
",Grand Sonoran G,http://ire.org/events-and-training/event/2703/3298/
,"Leaks, leakers and the law",2017-06-22,11:30 a.m.,2017-06-22,12:30 p.m.,"Sarah N Lynch, Amanda Kane, Karen Williams, Ian MacDougall","**Moderated by Sarah N. Lynch, Reuters
Authentic, reliable non-public information is at the heart of true investigative reporting. Whether sourced from a corporate whistleblower, a government employee exposing corruption, or the nosey neighbor of an elected official – all leaks collide with the law in ways that can place the journalist and their source in serious jeopardy. This panel will focus on how to effectively navigate the legal risks that attend leaks and leakers, including handling of leaked documents, publication of confidential personal information, protective measures that may be taken when faced with government or corporate leak investigations, grand jury leaks and the special risks associated with leaks of classified information. The three panel members will bring their unique experience and perspectives on leaks and the law – from the federal government, international media and major corporate legal practice – to this lively discussion about a subject that is likely to make a great deal of news in the next four years.
",Grand Canyon 7,http://ire.org/events-and-training/event/2703/3207/
,Winners announcement: Knight prototype call for ideas to improve the flow of accurate information (Hosted by Knight Foundation),2017-06-22,11:30 a.m.,2017-06-22,1:00 p.m.,"Bill Adair, Jennifer Preston, Jonathan Kartt, Scott Klein, Josh Stearns, Amanda Zamora, John Bracken","Join Knight Foundation as we, with Democracy Fund, and Rita Allen Foundation, announce the winners of the prototype call for ideas to improve the flow of accurate information.
Following the announcement Jennifer Preston, VP/Journalism at the Knight Foundation will moderate a panel with Bill Adair, Politifact, Amanda Zamora,Texas Tribune and Scott Klein, ProPublica to discuss the ideas and themes that emerged from the open call, why they are excited about the winning projects, and what they see as trends in the industry.
",Grand Canyon 4-5,http://ire.org/events-and-training/event/2703/3205/
,When mental health and criminal justice collide,2017-06-22,11:30 a.m.,2017-06-22,12:30 p.m.,"Josh Hinkle, Kimbriell Kelly, Eric Wieffering","This session examines the overwhelming number of mental health-related cases surrounding police shootings and violence against law enforcement. Panelists will show you how to find evidence and data on this private topic and discuss how to overcome challenges when it comes to reporting on such a sensitive issue.
",Grand Canyon 9-10,http://ire.org/events-and-training/event/2703/3209/
,IRE Commons: Ask a nerd - Answers to your questions about all the things,2017-06-22,11:30 a.m.,2017-06-22,12:30 p.m.,Cody Winchester,"Confused by CAR? Puzzled by Python? Jarred by JSON? Flummoxed by, uh, FORTRAN? This is your chance to ask a nerd! There are no dumb questions. If we don't know the answer, we'll hook you up with someone who can (or consult our good friend Stack O. Verflow).
",IRE Commons,http://ire.org/events-and-training/event/2703/3408/
,Battling FERPA and cracking campus secrecy,2017-06-22,11:30 a.m.,2017-06-22,12:30 p.m.,"Frank LoMonte, Michael Vasquez, Paula Lavigne","The session will discuss some of the methods colleges and universities use to withhold information about students, student athletes, criminal activity, business contracts, finances and other aspects of higher education, including the oft-cited FERPA student privacy law. It will address the differences in access between public and private institutions. And it will offer tools and ideas on how to use your sources, public records laws and other resources to get the information, documents and data you need.
",Grand Canyon 6,http://ire.org/events-and-training/event/2703/3206/
tableau,Finding and telling data stories with Tableau Public (Hosted by Tableau),2017-06-22,1:30 p.m.,2017-06-22,3:00 p.m.,Ben Jones,"Got a dataset and an impending deadline to write a story on it? Find the scoop and convey it with beautiful, interactive visualizations in a serial narrative using Tableau Public. It's a fast, easy to use, and free tool for journalists. Visualizations will publish using any CMS and no programming is required.
We'll teach you how to:
No previous experience with Tableau is necessary to attend. Laptops will be provided. This is a free training, however you must be registered for the IRE Conference to attend this class.  Limited seats are available.  There may be a few seats available on-site.
",Pinnacle Peak 1,http://ire.org/events-and-training/event/2703/3336/
,IRE Board of Directors meeting,2017-06-22,2:00 p.m.,2017-06-22,5:00 p.m.,TBA,"The IRE Board of Directors will meet on Thursday from 2-5 p.m. in Wildflower A, as part of the annual conference. The meeting is open to all IRE members.
",Wildflower A,http://ire.org/events-and-training/event/2703/3362/
,Watchdogging the court system,2017-06-22,2:30 p.m.,2017-06-22,3:30 p.m.,"Lisa Armstrong, Andrew Lehren, Josh Salman","Judicial bias. Juveniles in jail. Profiting from diversion programs. Bias in ticketing. A deep dive on mining data, digging into public records and finding sources for under-reported investigations on the court system.
",Grand Canyon 9-10,http://ire.org/events-and-training/event/2703/3215/
