Topic,Subject,Start Date,Start Time,End Date,End Time,Speaker(s),Description,Location,URL
,IRE Conference Registration (Wednesday),2016-06-15,2:00 p.m.,2016-06-15,6:00 p.m.,TBA,,"Preservation Booth, 2nd floor",http://ire.org/events-and-training/event/2199/2741/
,10 great business databases to mine for stories (Sponsored by the Donald W. Reynolds National Center for Business Journalism),2016-06-15,2:00 p.m.,2016-06-15,4:00 p.m.,Steve Doig,"Data journalist Stephen Doig, the Knight Chair at Arizona State University's Walter Cronkite School of Journalism and Mass Communication, will demonstrate 10 data sources you may never have heard of that can lend rich context to your business and economic stories and spark meaningful investigations in this pre-conference workshop, sponsored by the Donald W. Reynolds National Center for Business Journalism on Wednesday, June 15 from 2-4 p.m.
From ZIP code-level business patterns to foreign trade imports and exports and hospital data, Doig will walk you through seldom-used databases that hold treasures for reporters. You'll learn what's in the data sets, how to get them, what you can pull from them, what questions to ask of the data and story ideas that could be developed, and you'll leave armed with new knowledge and fresh ideas. Registration for the workshop will begin at 1:30 p.m. on Wednesday, June 15.
",Galerie 3,http://ire.org/events-and-training/event/2199/2559/
,The jazz scene in New Orleans after Katrina,2016-06-15,4:30 p.m.,2016-06-15,6:30 p.m.,Don Vappie,"One of the most outstanding jazz players in New Orleans, Don Vappie, will share his insights on, how Katrina affected jazz in New Orleans. He will cover the discussions between musicians, the jazz scene and the music. He will demonstrate with his banjo and song.
",Balcony K,http://ire.org/events-and-training/event/2199/2766/
,IRE Sales Table (Thursday),2016-06-16,7:30 a.m.,2016-06-16,6:00 p.m.,TBA,"Stop by the IRE sales table and take a look at our merchandise. We will be selling books, the large selection of titles we carry will certainly include your interests. All proceeds from your purchase help support IRE and its mission.  Sales will be located in Preservation Hall on the 2nd floor of the New Orleans Marriott.
",Preservation Hall,http://ire.org/events-and-training/event/2199/2745/
,IRE Conference Registration (Thursday),2016-06-16,7:30 a.m.,2016-06-16,6:00 p.m.,TBA,,"Preservation Booth, 2nd floor",http://ire.org/events-and-training/event/2199/2742/
,Welcome and overview of the conference,2016-06-16,8:30 a.m.,2016-06-16,8:50 a.m.,TBA,,Salon E,http://ire.org/events-and-training/event/2199/2788/
,Investigative parternships,2016-06-16,9:00 a.m.,2016-06-16,10:00 a.m.,"Ellen Gabler, Keith Esparros, Manuel Torres, Jeff Adelson, Greg Phillips","**Moderated by Ellen Gabler, Milwaukee Journal Sentinel
Hear from two powerhouse reporting teams that produced major investigations through partnerships. We'll discuss why you'd even want to partner; how to build trust between reporting teams; tips for managing deadlines and multiple editors; and how to handle the general logistics of collaborating between newsrooms. Our panelists melded talent from online, print and TV news organizations to supersize their investigations - and will explain how you can do the same.
",Studio 9-10,http://ire.org/events-and-training/event/2199/2544/
,Exhibitor/Recruiter Hours (Thursday),2016-06-16,9:00 a.m.,2016-06-16,5:00 p.m.,TBA,,Preservation Hall,http://ire.org/events-and-training/event/2199/2751/
tableau,Interactive data graphics in Tableau Public (Hosted by Tableau) *pre-registered attendees only,2016-06-16,9:00 a.m.,2016-06-16,10:30 a.m.,Ben Jones,"Learn how to create beautiful, interactive data visualizations on short deadlines. No programming required. You'll learn everything you need to build data visualizations and publish them to your website just like a video. We'll teach you how to:
•Connect to Excel files and other data•Create maps and charts•Make them interactive•Publish them on your site
Tableau Public is a free tool for journalists. No previous experience with Tableau is necessary to take this class. Laptops will be provided. This is a free training, however you must be registered for the IRE Conference to attend this class. Limited seats are available. There may be a few seats available on-site.
Register for this class
",Salon C,http://ire.org/events-and-training/event/2199/2696/
,Web scraping for anyone,2016-06-16,9:00 a.m.,2016-06-16,10:00 a.m.,Samantha Sunne,"You don't have to write code to coax data off the web - with some clicks and tricks and elbow grease, you can get data and documents even your sources don't want you to have. We'll cover tools you can use out of the box, more advanced techniques, plus secret Internet passageways to the data you want.
",Salon B,http://ire.org/events-and-training/event/2199/2705/
,Tracking government spending,2016-06-16,9:00 a.m.,2016-06-16,10:00 a.m.,"Ziva Branstetter, Colby Goodman, Norberto Santana Jr.","Tracking government spending isn't just about aimlessly pouring over data and looking for trends. It's about connecting the dots, showing human impacts of government spending – or lack thereof - as well as detailing how special interests shape government. In this session, you'll learn how to really open up government budgets, as well as standard agency financial disclosures, conflict of interest forms for government officials and connect campaign finance data to government contracts to tell compelling stories.
",Salon F-H,http://ire.org/events-and-training/event/2199/2560/
,Show & Tell *Thursday - #1 (Sponsored by Napoli Management Group),2016-06-16,9:00 a.m.,2016-06-16,10:00 a.m.,Kevin Keeshan,"**Moderated by Kevin Keeshan, NBC Owned Television Stations
Show & Tell sessions allow you to share your investigations with colleagues from around the country. Veteran broadcasters will moderate each session. Each slot runs for 10 minutes and includes a 5-minute break.
Reserve a slot online: Thursday sign-ups open at 9 a.m. on Wednesday.
",Galerie 2,http://ire.org/events-and-training/event/2199/2713/
,Getting your stuff together,2016-06-16,9:00 a.m.,2016-06-16,10:00 a.m.,"Andrea Parquet-Taylor, Cheryl W. Thompson, T. Christian Miller, Marina Trahan Martinez","**Moderated by T. Christian Miller, ProPublica
It's an unsung talent: being organized. But it's crucial to pulling off long projects and cranking out investigations while on the beat. In this session, we'll go step-by-step through reporters' own processes to see how they manage time and information, including tips on specific tools to use.
",Salon D,http://ire.org/events-and-training/event/2199/2664/
,Who can read your story? The digital divide (Sponsored by Media Democracy Fund),2016-06-16,9:00 a.m.,2016-06-16,10:00 a.m.,"Christopher Mitchell, Matthew Rantanen, Michael Scurato","Fifteen percent of Americans don't use the internet—and they aren't all seniors. In rural areas, on reservations and in prisons, many users simply don't have access. The story of lack of access deepens when we overlay “access” with economic data. For example, 62% of Spanish-dominant Latinos do not have broadband access at home. A significant number of users can't afford to have access when or how they want it.
We'll explore questions like, do users really have internet access if the only access is mobile wireless or, if the cost is 10% of their monthly wage? Will the proposed lifeline program impact a significant number of people? Speakers will also explain the implications of lifeline access, the hope community broadband offers, and provide tools/sources so you can investigate internet access across geographic, demographic and policy lines.
",Galerie 4-5,http://ire.org/events-and-training/event/2199/2680/
,Mapping Camp *pre-registered attendees only,2016-06-16,9:00 a.m.,2016-06-16,6:00 p.m.,"David Herzog, Jennifer LaFleur","Learn how to uncover interesting news stories by mapping data with geographic information system (GIS) software during our intensive mini-boot camp and receive a free copy of ArcGIS Desktop*.
IRE and NICAR trainers conduct this hands-on training using the latest version of ArcGIS Desktop. We will look at noteworthy stories that have used mapping and show you how to uncover stories using census and other data. You'll learn how to display data geographically; import and query data; geocode to merge databases with addresses into maps. Attendees will also learn how ArcGIS Online may help as a storytelling platform. In addition, we'll provide you with our boot camp materials to help keep you on track long after you leave the conference. 
Participants should have some experience working with data in a relational database manager, such as Microsoft Access or MySQL. Preregistration is required and seating is limited. Laptops will be provided for the training. Please note the desktop software is available only for Windows but ArcGIS Online can be used from any platform.
*Attendees of the boot camp have the option to receive the following discounts from Esri. (1) A free license of ArcGIS Desktop that will not expire and includes one year call-in technical support and upgrades at no cost. Call-in technical support and upgrades are available on a nominal fee basis in year two. (2) A free one-year subscription to ArcGIS Online that includes access to Esri's Community Analyst database. Please contact the Esri Media Relations team press@esri.com for further information. The desktop software is available only for Windows but ArcGIS Online can be used from any platform.
Attendees must be registered for the conference to attend this workshop.
NOTE: Registration is required for this session. Click here to sign up.
",Salon A,http://ire.org/events-and-training/event/2199/2540/
,An insider's guide to IRE16,2016-06-16,9:00 a.m.,2016-06-16,10:00 a.m.,"Kristin Hussey, Sarah Hutchins, Megan Luther, Charlotte Huffman","**Moderated by Megan Luther, IRE/NICAR
Your first (or second, or third) IRE Conference can be overwhelming. This panel will provide tips on how to make the most of your time in New Orleans. Learn from our mistakes and figure out which sessions will best fit your needs. We'll also show you how to make the most of your IRE membership so you can continue to benefit once you're back home.
",Salon E,http://ire.org/events-and-training/event/2199/2555/
,Investigative reporting on a shoestring,2016-06-16,9:00 a.m.,2016-06-16,10:00 a.m.,"Esther Kaplan, Lee Fang, Kathryn Joyce, Kelly Virella, Trevor Aaronson, Seth Wessler","**Moderated by Esther Kaplan, The Investigative Fund
Many IRE award-winning stories are produced by large teams. But what if you're an army of one? This panel is designed for freelancers and reporters in tiny newsrooms who want to think big on investigations without being able to lean on robust newsroom resources.
",Galerie 3,http://ire.org/events-and-training/event/2199/2691/
,Follow the money to tax havens (Sponsored by Knight Foundation),2016-06-16,9:00 a.m.,2016-06-16,10:00 a.m.,Miranda Patrucic,"You don't always need the Panama Papers to get Panama Papers. In fact, a share of the records used in the historic groundbreaking investigation was actually gathered from offshore public record depositories around the world. In this session, you will learn how to access the records from tax heavens that seem impossible to get.
",Galerie 1,http://ire.org/events-and-training/event/2199/2571/
,Working with African newsrooms: From collaboration to coding (Sponsored by International Center for Journalists),2016-06-16,10:15 a.m.,2016-06-16,11:15 a.m.,"Amanda Strydom, David Lemayian","From power cuts to palace coups, working with African newsrooms is never simple. But for all its challenges, the continent is also one of the most mobile and connected. This unique mix of high and low tech creates opportunities for experimentation unheard of in the developed world. Lemayian and Strydom will give you a glimpse on how they are getting African newsrooms to collaborate and innovate.
",Salon E,http://ire.org/events-and-training/event/2199/2556/
,Deep dives: Issues you can explore in your community,2016-06-16,10:15 a.m.,2016-06-16,11:15 a.m.,"Jessica Terrell, Todd Wallack, Jaimi Dowdell, Katherine Sayre","**Moderated by Jaimi Dowdell, IRE/NICAR
Three veteran journalists will share tips and lessons they learned covering stories about homelessness, a dying town, residential parking, government boards and more. You'll leave this session with a pocketful of evergreen ideas along with guidance on how to make the stories come to life.
",Salon F-H,http://ire.org/events-and-training/event/2199/2561/
,Show & Tell *Thursday - #2 (Sponsored by Napoli Management Group),2016-06-16,10:15 a.m.,2016-06-16,11:15 a.m.,Susana Schuler,"**Moderated by Susana Schuler, Raycom Media
Show & Tell sessions allow you to share your investigations with colleagues from around the country. Veteran broadcasters will moderate each session. Each slot runs for 10 minutes and includes a 5-minute break.
Reserve a slot online: Thursday sign-ups open at 9 a.m. on Wednesday.
",Galerie 2,http://ire.org/events-and-training/event/2199/2714/
,Educators: Doing investigations with students,2016-06-16,10:15 a.m.,2016-06-16,11:15 a.m.,"Deborah Nelson, Mark Horvit, Neil Reisner, Brandon Quester","**Moderated by Mark Horvit, IRE/NICAR
More and more investigative journalism is being conducted on college campuses. Several professors who work with students to conduct in-depth projects will talk about how they select topics, manage students (individuals and teams) and help them overcome obstacles.
",Studio 9-10,http://ire.org/events-and-training/event/2199/2657/
,Tools and tips for the reporting process (Sponsored by Knight Foundation),2016-06-16,10:15 a.m.,2016-06-16,11:15 a.m.,"Daniel Connolly, Lauren Grandestaff, Jesse Patel","Organization and time management can challenge even the most experienced investigative reporter. In this session, you'll see demos of electronic tools that make your life easier. From the very start of your story to hitting publish, these tools will allow you to manage even the biggest of projects. Scrivener allows you to keep track of documents, photos, audio recordings and video, all in the same investigation file. DocumentCloud allows you to track piles of documents for your investigations, collaborate amongst your newsroom and others, and present the most important parts to the public. And Workflowy, lets you take notes, make lists, collaborate, brainstorm and plan your life.
",Galerie 1,http://ire.org/events-and-training/event/2199/2728/
,NICAR Commons: How to enter (and win) a duPont Award,2016-06-16,10:15 a.m.,2016-06-16,11:15 a.m.,Lisa Cohen,"**Moderated by Lisa R. Cohen, Columbia Journalism School
In this session, Lisa R. Cohen will discuss and demystify the duPont Award process. She will be joined by former award winners Cheryl Devall, Reveal/CIR; Jason Trahan, WFAA-Dallas/Fort Worth and Lee Zurik, WVUE-New Orleans.
",Preservation Hall,http://ire.org/events-and-training/event/2199/2786/
spreadsheets,Excel 1: Getting started with spreadsheets,2016-06-16,10:15 a.m.,2016-06-16,11:15 a.m.,Patti DiVincenzo,"In this introduction to spreadsheets you'll begin analyzing data with Excel, a simple but powerful tool. You'll learn how to enter data, sort it, filter it and conduct simple calculations like sum, average and median.
Prerequisites: None.
",Salon B,http://ire.org/events-and-training/event/2199/2640/
,Watchdogging sports,2016-06-16,10:15 a.m.,2016-06-16,11:15 a.m.,"Paula Lavigne, Noah Pransky, Brad Wolverton","From youth basketball to college hockey to the National Football League, sports is not just a form of entertainment, but a multi-billion-dollar industry and a force for social change with local, national and global impact. Find out how to examine the financial, social, medical, legal, criminal and other off-field aspects of sports organizations and teams and the myriad of agencies that regulate them. And learn about the unique aspects of investigating athletes beyond the locker room.
",Salon D,http://ire.org/events-and-training/event/2199/2550/
,Broadcast: When things change dramatically,2016-06-16,10:15 a.m.,2016-06-16,11:15 a.m.,"Jodie Fleischer, Chris Nakamoto, Rick Yarborough","We all try to make sure every detail is buttoned up before airing an investigation. But sometimes that curve ball is just unavoidable. This panel will focus on unusual developments with investigations. From last minute court settlements aimed at squashing your report, to your source unexpectedly becoming the subject of your investigation, or even reporters finding themselves in handcuffs. Hear how these journalists dealt with the 11th hour developments and still got their stories on air.
",Galerie 3,http://ire.org/events-and-training/event/2199/2566/
,Tracking down investigative threads,2016-06-16,10:15 a.m.,2016-06-16,11:15 a.m.,"Charles Lewis, Alison Young, Dan Kane","How do you find and choose which investigative threads to follow? How do you stay on track when you have too many threads interweaving simultaneously? What do you do when the thread you are chasing goes dark? How do you keep from getting lost along the way? Hear how three investigative reporters approach these problems to produce high-impact stories. And they'll give you practical tips for organizing reporting and keeping complex projects on track – especially if you are juggling other stories at the same time.
",Galerie 4-5,http://ire.org/events-and-training/event/2199/2563/
tableau,Advanced design and interaction in Tableau Public (Hosted by Tableau) *pre-registered attendees only,2016-06-16,11:00 a.m.,2016-06-16,12:30 p.m.,Dash Davidson,"Analyzing data and coming up interactive visualizations is easy in Tableau but sometimes getting everything looking polished isn't. In this session you will learn how to break away from the default formatting in Tableau Public to create interactive data graphics that match your style guides and engage your readers. We will teach you how to:
•change colors, shapes, borders, fonts, and other basic formatting•incorporate images, logos, and other graphic elements•take advantage of advanced interaction techniques to incorporate multimedia•utilize design and layout best practices to make sure that your visualization looks polished and professional
Tableau Public is a free tool for journalists. Some familiarity with the product is recommended; a beginner session earlier in the day should prepare you enough for this session. Laptops will be provided. This is a free training, however you must be registered for the IRE Conference to attend this class. Limited seats are available. There may be a few seats available on-site.
Register for this class
",Salon C,http://ire.org/events-and-training/event/2199/2697/
,NICAR Commons: Story clinic,2016-06-16,11:30 a.m.,2016-06-16,12:30 p.m.,"Jaimi Dowdell, Mark Horvit, Liz Lucas, Megan Luther, Alex Richards","Got a question on how to pursue a story? Curious about how to approach a FOIA? Stumped by some data? IRE and NICAR staff will be available to offer advice. Story consultations are confidential and will be offered on a first-come, first-served basis.
",Preservation Hall,http://ire.org/events-and-training/event/2199/2780/
,Data viz storytelling,2016-06-16,11:30 a.m.,2016-06-16,12:30 p.m.,"Dianne Finch, Ed Lowther, Shane Shifflett, Cheryl Phillips","**Moderated by Cheryl Phillips, Stanford University
There are maps, charts and interactives to be built and pie charts to avoid, for sure. But the truth is, just like anything in journalism, making a data visualization that works is all about the story. The trick is knowing enough about the structure and forms to make the viz it's own kind of narrative. Learn some of the best practices and key tips to make your data visualizations sing. 
",Salon D,http://ire.org/events-and-training/event/2199/2545/
,The art of cultivating and protecting whistleblowers (Sponsored by NBC News and MSNBC),2016-06-16,11:30 a.m.,2016-06-16,12:30 p.m.,"Josh Meyer, Angie Moreschi, Marta Jewson, Michael Hudson","**Moderated by Josh Meyer, NBC News
Finding, cultivating – and protecting – whistleblowers is both a science and an art, and it has long been a cornerstone of good watchdog journalism. Doing it right can often mean the difference between a decent story and a great, and potentially prize-winning, one. But mishandling well-placed sources who leak information has all sorts of pitfalls for everyone involved. Learn the nuts and bolts of working with whistleblowers from some of the best – journalists who have used them with great success on the local, national and international level. â
",Galerie 4-5,http://ire.org/events-and-training/event/2199/2564/
,Government data to drive your stories (Sponsored by Knight Foundation),2016-06-16,11:30 a.m.,2016-06-16,12:30 p.m.,"Troy Thibodeaux, Tyson Weister","In this session we'll take a tour of some useful government data sources along with tips for getting the most from them. In addition, we'll offer a deep dive into data available from the U.S. Census Bureau.
",Galerie 1,http://ire.org/events-and-training/event/2199/2690/
,Do criminal and municipal courts treat defendants fairly? (Sponsored by Criminal Justice Journalists),2016-06-16,11:30 a.m.,2016-06-16,12:30 p.m.,"Kendall Taggart, Ted Gest, Judge Arthur L. Hunter, Jr., John Simerman"," **Moderated by Ted Gest, Criminal Justice Journalists
 
The aftermath of the Ferguson, Mo., police shooting raised questions about how lower courts around the nation are treating defendants in a wide variety of cases. Critics say that some jurisdictions have been operating courts in ways that discriminate against minorities and others who cannot easily get legal help or pay fines in relatively minor cases. Reporters who follow these questions and a judge from a large urban court will discuss how journalists can report in depth on legal issues that often don't get much play in local media.
",Studio 9-10,http://ire.org/events-and-training/event/2199/2546/
,From lone wolf to team player: The evolution of the investigative reporter,2016-06-16,11:30 a.m.,2016-06-16,12:30 p.m.,"Jennifer LaFleur, Roy Harris, James B. Steele, James Grimaldi","**Moderated by Roy Harris, independent journalist
Investigative journalism at the turn of the 20th Century relied, for the most part, on a breed of driven newspaper and magazine reporters working solo, and keeping their sources to themselves. Much changed starting in the 1960s, with the rise of team journalism (including the birth of IRE) at places like Bob Greene's Newsday and the Boston Globe's Spotlight operation. Duos along the lines of Woodward-Bernstein and Barlett-Steele sprang up, and so did investigative editing specialists and, recently, intra-organizational collaborations. Reporting and editing legends Jim Steele and James Grimaldi join the Center for Investigative Reporting's Jennifer LaFleur in a discussion of what's been gained, and lost, along the way. Roy Harris, author of “Pulitzer's Gold,” a book on the century-long tradition of winners in the public service category, moderates.
",Salon E,http://ire.org/events-and-training/event/2199/2557/
,Following the money (Sponsored by Bloomberg),2016-06-16,11:30 a.m.,2016-06-16,12:30 p.m.,"Rob Barry, Mark Lagerkvist, Duane Pohlman, Michael Sallah","**Moderated by Duane Pohlman, WCMH/NBC4 Columbus
Sure it's a cliche. But it's still some of the best advice in journalism: track the funds to find the power, or the problems, or the answers. Three veteran journalists give tips and examples that will help you find the key money trails in your own stories.
",Salon F-H,http://ire.org/events-and-training/event/2199/2607/
,Uncovering stories on the health beat,2016-06-16,11:30 a.m.,2016-06-16,12:30 p.m.,"Ellen Gabler, Ryann Grochowski Jones, Jeanne Whalen, Jenn Abelson","**Moderated by Ellen Gabler, Milwaukee Journal Sentinel
Tap into the full potential of investigations on the health beat. We'll talk about where to look for ideas, how to negotiate for data and documents, and finding people who have been affected by whatever you're writing about. As healthcare costs soar and pandemics travel across borders, the interest in these stories is huge. Get specific tips on dealing with government agencies, finding experts and sorting through science when people are trying to confuse you.
",Galerie 3,http://ire.org/events-and-training/event/2199/2673/
spreadsheets,Excel 2: Functions and pivot tables,2016-06-16,11:30 a.m.,2016-06-16,12:30 p.m.,Crina Boros,"In this class you'll learn how to use formulas to analyze data with the eye of a journalist using calculations like change, percent change and rates. It will also focus on the power of pivot tables for analysis in minutes rather than hours.
Prerequisites: This class will be most helpful if you've taken Excel 1 or have worked with a spreadsheet in the past.
",Salon B,http://ire.org/events-and-training/event/2199/2641/
,Show & Tell *Thursday - #3 (Sponsored by Napoli Management Group),2016-06-16,11:30 a.m.,2016-06-16,12:30 p.m.,Patti Dennis,"**Moderated by Patti Dennis, TEGNA, Inc.
Show & Tell sessions allow you to share your investigations with colleagues from around the country. Veteran broadcasters will moderate each session. Each slot runs for 10 minutes and includes a 5-minute break.
Reserve a slot online: Thursday sign-ups open at 9 a.m. on Wednesday.
",Galerie 2,http://ire.org/events-and-training/event/2199/2715/
,Lunch on your own (Thursday),2016-06-16,12:30 p.m.,2016-06-16,2:30 p.m.,TBA,,See printed schedule for room information,http://ire.org/events-and-training/event/2199/2749/
