Topic,Subject,Start Date,Start Time,End Date,End Time,Speaker(s),Description,Location,URL
,Digging into data for stories: A crash course **pre-registered attendees only,2016-06-17,9:00 a.m.,2016-06-17,6:15 p.m.,TBA,"Even if you've never touched a spreadsheet, you will walk away from this day-long workshop able to use Excel for your next investigation. You'll come away with plenty of story ideas and also learn about publicly available databases that you can download and analyze to produce great local stories.
In this workshop, led by experienced IRE and NICAR trainers, we'll explore how to use Excel, a fairly simple but powerful spreadsheet application, to begin analyzing data for stories. We'll start from the beginning with basic formulas and work our way up to summarizing information using PivotTables and more. How do you think about data analysis as a journalist? How do you find the story within the columns and rows? Depending on the experience level of the group we may discuss advanced functions in Excel including data cleaning and more. 
We'll walk through a number of searchable databases currently available online and show you how you can download information into a spreadsheet so you can start analyzing data as soon as you leave the workshop.
No previous experience is required for this workshop. Preregistration is required and seating is limited. Computers will be provided for the training. **Attendees must be registered for the conference to attend this workshop.
NOTE: Registration is required for this session. Click here to sign up.
",Salon B,http://ire.org/events-and-training/event/2199/2541/
,Exhibitor/Recruiter Hours (Friday),2016-06-17,9:00 a.m.,2016-06-17,5:00 p.m.,TBA,,Preservation Hall,http://ire.org/events-and-training/event/2199/2752/
,All about the analysis,2016-06-17,9:00 a.m.,2016-06-17,10:00 a.m.,"Rob Barry, Crina Boros, Steven Rich, Chrys Wu","**Moderated by Chrys Wu, The New York Times
We talk about interrogating the data, but exactly what does that mean? What questions should be we asking? How do we formulate those questions? What about running various analysis techniques that might surface ""interesting"" outliers in data? Or is the answer always ""Apply the random forest classification technique""? Our panel of experienced data journalists will explore the intricacies of data analysis.
",Salon D,http://ire.org/events-and-training/event/2199/2692/
,Ethnic media track the impact of hate speech in 2016 election (Sponsored by Ford Foundation and New America Media),2016-06-17,9:00 a.m.,2016-06-17,10:00 a.m.,"Anthony Advincula, Minhaj Hasan, Chris King, Juan Esparza Loera, Jenise Morgan, Joe Wei","**Moderated by Anthony Advincula, New America Media
Hate speech and demonizing specific groups by public figures has become standard political discourse in the 2016 election campaign. Ethnic news organizations, serving several target populations, report on what they are doing to monitor the fallout in their communities and what they're finding: Increased levels of intimidation and self-censorship, reports of micro-aggression, verbal and physical violence and strategies to fight back.
",Galerie 6,http://ire.org/events-and-training/event/2199/2704/
,Finding the story: A data tour (Sponsored by Knight Foundation),2016-06-17,9:00 a.m.,2016-06-17,10:00 a.m.,"Mark Nichols, Christopher Schnaars, Russ Ptacek, Katy Stech, Jaimi Dowdell","**Moderated by Jaimi Dowdell, IRE/NICAR
This session will highlight data sources you can mine to uncover stories in your community. Panelists will take a deep dive into bankruptcy, campaign finance, lottery and water data. Check out examples of stories others have done and see how you can put this data to work for yourself.
Each panelist will be teaching a ""Finding the data"" hands-on class later in the conference where you can get experience working with the data yourself. The series of classes includes:
Finding the story:Water
Finding the story:Cracking the political piggy bank
Finding the story: Digging up secrets and story ideas in bankruptcy court records
 Finding the story: Lottery scandals
 Finding the story: Bridges
",Galerie 1,http://ire.org/events-and-training/event/2199/2585/
,Social media on the map,2016-06-17,9:00 a.m.,2016-06-17,10:00 a.m.,Doug Haddix,"Social media + location = precision reporting. Filter the firehose of social media posts by location to focus like a laser on your city or region. Discover the latest apps, tools and tactics to pinpoint experts, witnesses, story angles, photos, videos and other material in a particular city or even near a specific address. Empowered with these tools, you will stay several steps ahead of your competitors, especially during breaking news.
",Salon F-H,http://ire.org/events-and-training/event/2199/2598/
,The business of freelancing: Running a business (Sponsored by the Fund for Investigative Journalism and FIRE),2016-06-17,9:00 a.m.,2016-06-17,10:00 a.m.,"Carlos Dada, Laird Townsend, Katia Bachko, Katie Townsend, Lee van der Voo","**Moderated by Laird Townsend, Project Word
This session will cover practical advice on how freelancers can remain economically viable in the public interest. From how to approach grant-raising, time management, tax strategy, and business structure; to how to think about contract, copyright, repurposing, and options. You'll leave with the variables needed for success in starting a news site, how to save time in FOIA requests and avoid legal trouble.
",Studio 9-10,http://ire.org/events-and-training/event/2199/2656/
spreadsheets,Excel 1: Getting started with spreadsheets (repeat session),2016-06-17,9:00 a.m.,2016-06-17,10:00 a.m.,Jamie Grey,"In this introduction to spreadsheets you'll begin analyzing data with Excel, a simple but powerful tool. You'll learn how to enter data, sort it, filter it and conduct simple calculations like sum, average and median.
Prerequisites: None.
",Salon A,http://ire.org/events-and-training/event/2199/2631/
,NICAR Commons: What to do about dedicated but frustrating editors,2016-06-17,9:00 a.m.,2016-06-17,10:00 a.m.,Alison Young,"**Moderated by Alison Young, USA TODAY NETWORK
Reporters will get together to share strategies for pursuing watchdog and investigative stories while working for editors whose management styles can make the work more difficult. These types of editors include those who are unable to prioritize daily and enterprise workloads, as well as those who don't understand how investigative reporting is done. We'll also discuss strategies for dealing with editors who are micromanagers and overzealous rewriters, as well as those who try to push a story's conclusions beyond what the reporting shows. Bring your tips for how you've successfully managed challenging editor situations.
",Preservation Hall,http://ire.org/events-and-training/event/2199/2775/
,Robots that report: How fact-checkers worldwide are experimenting with automation,2016-06-17,9:00 a.m.,2016-06-17,10:00 a.m.,"Alexios Mantzarlis, Bill Adair","With small staffs and an ocean of false claims to verify, fact-checkers in France, the U.K., the U.S. and elsewhere are experimenting with automation in different stages of the fact-checking process. Tools have been built to find check-worthy claims, track false claims in the news and social media, automatically annotate false claims and pair them with fact checks published elsewhere. How far are we from a ""holy grail"" of entirely automated fact-checking? What can we do in the meantime? And how can developments in this field help investigative reporters in their work?
",Salon E,http://ire.org/events-and-training/event/2199/2594/
,Broadcast: Visuals - Making the story sing,2016-06-17,9:00 a.m.,2016-06-17,10:00 a.m.,"Anna Hewson, Evan Stulberger, Felipe Escamilla, Peter Hull","Turning an investigation into a visual video masterpiece isn't easy. Documents are dull, numbers are numbing, and talking heads are torture. This panel of expert storytellers will show you how they transform these bland elements into emotional and informative stories that really sing. You'll learn from the masters as they share their creative methods and tools. Their strategies will show you how to elevate the production value of your pieces, even with limited resources and looming deadlines. These are techniques that won't just bring video-poor stories to life, but will transform them into clear, powerful pieces that connect with audiences.
",Galerie 3,http://ire.org/events-and-training/event/2199/2580/
,Under pressure: Real life in real time with breaking news,2016-06-17,9:00 a.m.,2016-06-17,10:00 a.m.,Stephen Stock,"Come experience the real heart pounding excitement of a breaking news simulation where your investigative reporting and computer assisted reporting skills will be put through the ringer and to the test as teams compete to see who can break real, enterprise news in a minute by minute breaking news scenario. Sharpen your skills or learn new techniques to take back to your newsroom to help your team win the day the next time a big breaking news story happens in your backyard.See how good your skills really are. This class will teach you skills you can also use for everyday general assignment reporting/stories to take your career to the next level (not just breaking news.)
Prerequisites: None. This class can be useful to anyone from novice beginners to experienced internet jockeys.
",Salon C,http://ire.org/events-and-training/event/2199/2643/
spreadsheets,When Excel isn't enough (Sponsored by Knight Foundation),2016-06-17,10:15 a.m.,2016-06-17,11:15 a.m.,Thomas Thoren,"Excel is a great tool for most jobs, but it has its limitations. Large files can mean long wait times and it can be difficult to understand and reproduce old work. Databases, however, are faster and powerful enough to handle large amounts of data. And with SQL, you can easily document and reproduce your data analysis which means you'll be ready to quickly recreate a Census data analysis when new data is released.
You won't leave this session a database expert, but you will understand the benefits of databases and have a strong footing for getting started with SQL.
",Galerie 1,http://ire.org/events-and-training/event/2199/2586/
spreadsheets,Excel 2: Functions and pivot tables (repeat session),2016-06-17,10:15 a.m.,2016-06-17,11:15 a.m.,Ron Nixon,"In this class you'll learn how to use formulas to analyze data with the eye of a journalist using calculations like change, percent change and rates. It will also focus on the power of pivot tables for analysis in minutes rather than hours.
Prerequisites: This class will be most helpful if you've taken Excel 1 or have worked with a spreadsheet in the past.
",Salon A,http://ire.org/events-and-training/event/2199/2632/
,Show & Tell *Friday - #2 (Sponsored by Napoli Management Group),2016-06-17,10:15 a.m.,2016-06-17,11:15 a.m.,Ramon Escobar,"**Moderated by Ramon Escobar, CNN
Show & Tell sessions allow you to share your investigations with colleagues from around the country. Veteran broadcasters will moderate each session. Each slot runs for 10 minutes and includes a 5-minute break.
Reserve a slot online: Friday sign-ups open at 9 a.m. on Thursday.
",Galerie 2,http://ire.org/events-and-training/event/2199/2719/
,Quick and easy analysis without importing: csvkit!,2016-06-17,10:15 a.m.,2016-06-17,11:15 a.m.,Liz Lucas,"Sometimes you just want to ask your data a few questions before you start the process of importing it: How big is it? What's in it? If you have a text or csv file, csvkit can help you do this before you even open the file. It's simple and easy if you're not afraid to dive into the command line.
",Salon C,http://ire.org/events-and-training/event/2199/2706/
,Broadcast: What keeps your lawyer awake at night?,2016-06-17,10:15 a.m.,2016-06-17,11:15 a.m.,"Chris Moeser, Kevin Keeshan, Laura Lee Prather, Mary Ellen Roy","**Moderated by Kevin Keeshan, NBC Owned Television Stations
What are the latest concerns from three of the leading media lawyers in the news business? Social media and the emphasis on digital storytelling have changed the way investigative stories are produced and presented. How does this affect the way the lawyers approach each story? And where do they see the hazards ahead? We'll hear about their concerns, and how journalists can be better prepared to deliver bulletproof investigations across multiple platforms.
",Galerie 3,http://ire.org/events-and-training/event/2199/2581/
,After Ferguson: What's next for reporting on policing in America?,2016-06-17,10:15 a.m.,2016-06-17,11:15 a.m.,"DeRay Mckesson, Oliver Laughland, Errin Haines Whack, Wesley Lowery","Since Ferguson, national attention on police shootings and racial injustices has shifted all across the country, from Baltimore to Chicago, San Francisco, Cleveland, Louisiana, New Mexico, and beyond. Over the past two years, videos, social media, and news stories have brought a new level of scrutiny to police misconduct with fatal outcomes, legal systems that shield officers from accountability, and patchy federal oversight of such incidents. A panel of experts and journalists will look at how this beat has evolved since Ferguson, what those new to the beat should know, and what issues stand on the horizon—plus, story ideas therein.
",Salon D,http://ire.org/events-and-training/event/2199/2596/
,"David 1, Goliath 0: Fighting and winning open records battles",2016-06-17,10:15 a.m.,2016-06-17,11:15 a.m.,"Jason Leopold, Sarah Cohen, Brandon Smith, Matt Topic","**Moderated by Sarah Cohen, The New York Times
Get the tools and inspiration you need to successfully fight for records. Jason Leopold, a self-described FOIA terrorist, will share his strategies and advice on how to wrangle information from recalcitrant officials. He'll be joined by Brandon Smith, the journalist who sued the city of Chicago to release the Laquan McDonald police shooting video, and Matt Topic, the attorney who worked with Smith.
",Salon E,http://ire.org/events-and-training/event/2199/2595/
,Security: Bulletproofing the digital newsroom,2016-06-17,10:15 a.m.,2016-06-17,11:15 a.m.,"Jorge Luis Sierra, Mike Tigas","Learn what investigative journalists and their newsrooms can do to protect their information and communications' integrity from cyber attacks, espionage and eavesdropping launched by corrupt governments, criminal organizations or a combination of both. These skills and tools are a must to learn for digital newsrooms that rely on the internet and mobile phones to work.
",Salon F-H,http://ire.org/events-and-training/event/2199/2599/
,Management: Keep it together - Building and guiding a projects team,2016-06-17,10:15 a.m.,2016-06-17,11:15 a.m.,"Scott Allen, Michael Siconolfi, Chris Davis, David Fallis","**Moderated by David Fallis, The Washington Post
Do you really need an investigative team of reporters? How do you identify and choose the right stories to pursue? How do you ensure that projects don't drag on too long? And, how do you make sure there is a payoff in the end? This panel will tackle these and many other challenges that investigative editors face in newsrooms today.
",Galerie 4-5,http://ire.org/events-and-training/event/2199/2604/
,NICAR Commons: The Southern Girls Project,2016-06-17,10:15 a.m.,2016-06-17,11:15 a.m.,"Elizabeth Hoekenga, Connor Sheets, Diana Samuels","From obesity to educational-inequity to abortion access to Title IX, so many of our nation's most pressing issues come to land at the feet of girls in the American Deep South. Yet these very voices are wildly under-represented in today's media. Who talks to girls? More importantly – who listens?
In a new, open-source Southern Girls Project, journalists across the south are joining with girls, and their advocates, to dive deeper and learn more, examining the issues of the modern south through the eyes of girls from birth to 17 — from generational wealth and crushing poverty, insularity, religion, and the digital divide — and digging into stories too often overlooked.
This session will offer an overview of the project, seek feedback, and explain how news organizations and independent journalists can play a part. The project, stemming from AL.com's Alabama Investigative Journalism Lab, includes partners from NOLA.com, Mississippi Press, freelance journalists, researchers and girls across the south.
We're looking for data journalists, reporters, video storytellers, social media experts and all journalists who believe that listening to, and reporting with, an audience makes for better stories.
",Preservation Hall,http://ire.org/events-and-training/event/2199/2776/
,Rising waters: Investigating the impact of storms and the shrinking coast,2016-06-17,10:15 a.m.,2016-06-17,11:15 a.m.,"Deborah Nelson, Mark Schleifstein, Steve Beatty, Neena Satija","**Moderated by Steve Beatty, The Lens
Unless you're an intrepid eco-tourist, you're not likely to see what passes for a coastline in Louisiana. Likewise, casual visitors don't frequent the Houston Ship Channel. And many marshy inlets of Chesapeake Bay are known only to dedicated crabbers.  But activity in each place affects the lives of millions not far inland. Panelists will talk about getting the information that matters most to your audience, and how best to make it accessible, relevant and compelling.   
",Galerie 6,http://ire.org/events-and-training/event/2199/2688/
,Rolling your own data,2016-06-17,10:15 a.m.,2016-06-17,11:15 a.m.,"Robert Gebeloff, Sarah Ryley, Jennifer LaFleur","Sometimes there's a government database to FOIA. But often the best data for a story doesn't exist in database format. It's a collection of documents, or statistical tables trapped in PDF files. We'll show you examples of stories that were powered by data created from scratch, and provide tips for how to go about such a project.
",Studio 9-10,http://ire.org/events-and-training/event/2199/2551/
,Breaking news investigations,2016-06-17,11:30 a.m.,2016-06-17,12:30 p.m.,"Richard Pienciak, Andy Donohue, Laura Smitherman, Jenna Russell","**Moderated by Andy Donohue, Reveal/CIR
",Salon E,http://ire.org/events-and-training/event/2199/2666/
,Seafood from Slaves: The story behind an IRE Medal winner,2016-06-17,11:30 a.m.,2016-06-17,12:30 p.m.,"Mary Rajkumar,","Learn how a team of reporters from The Associated Press launched an investigation that helped free more than 2,000 enslaved workers. Reporter Martha Mendoza and editor Mary Rajkumar will offer insights into how journalists can use documents, data and sourcing to uncover similar abuses.
",Salon D,http://ire.org/events-and-training/event/2199/2591/
,Turning your investigation into: A podcast,2016-06-17,11:30 a.m.,2016-06-17,12:30 p.m.,"Gina Barton, Nikole Hannah-Jones, Sarah Hutchins, Bill Rankin","You don't have to work for a radio station to be part of the growing podcast movement. Whether you're interested in launching a multi-part series or producing a single episode, this session will help you learn how to turn your investigation into a compelling audio story. Learn from the journalists behind The Atlanta Journal-Constitution's ""Breakdown"" podcast and the Milwaukee Journal Sentinel's ""Unsolved."" We'll cover all the basics: deciding when a story deserves the podcast treatment, pitching it to editors, producing your story, and finding an audience.
",Salon F-H,http://ire.org/events-and-training/event/2199/2600/
,The evolution of data journalism education (Sponsored by Knight Foundation),2016-06-17,11:30 a.m.,2016-06-17,12:30 p.m.,"Sarah Cohen, Cheryl Phillips",,Galerie 1,http://ire.org/events-and-training/event/2199/2729/
,Mobile is now: Transforming newsrooms for the age of the smartphone,2016-06-17,11:30 a.m.,2016-06-17,12:30 p.m.,David Ho,"Mobile is not a platform. Mobile is THE platform. If your newsroom is not embracing mobile, you're behind. Learn to catch up and race ahead with best practices from David Ho, The Wall Street Journal's executive mobile editor. He will talk about WSJ's mobile approach and current focus on putting mobile at the center of the newsroom. Ho, the world's most experienced mobile and tablet editor, will also offer tips and advice for news organizations of all sizes on how to succeed in a world where the dominant news source is in your pocket.
",Studio 9-10,http://ire.org/events-and-training/event/2199/2616/
,NICAR Commons: Julia - One language to rule them all,2016-06-17,11:30 a.m.,2016-06-17,12:30 p.m.,Daniel Lathrop,"**Moderated by Daniel Lathrop, University of Iowa
If you follow the buzz on emerging programming languages, the Julia scientific programming language is all the rage. Importantly for data journalists, it is a statistically oriented language with the ability to easily use existing libraries for R, Python, C and even Java.
",Preservation Hall,http://ire.org/events-and-training/event/2199/2777/
,Revealing the cost of corporate welfare,2016-06-17,11:30 a.m.,2016-06-17,12:30 p.m.,"Greg LeRoy, Hilary Russ, Sarita Nair","An obscure new government-accounting rule covering budgets from calendar 2016 and beyond will require states and most cities, counties and school districts to report how much revenue they lose to economic development tax breaks. Governmental Accounting Standards Board (GASB) Statement No. 77 will enable big-picture and comparative analyses never before possible. From an activist who helped win the rule, a state official overseeing the rule's implementation, and veteran GASB reporter, learn how the Statement works, where the data will reside, who else is watching, and what the data could reveal. For reporters covering public budget issues, Statement No. 77 is likely to prove an investigative gold mine.
",Galerie 4-5,http://ire.org/events-and-training/event/2199/2693/
,Finding the story: Water,2016-06-17,11:30 a.m.,2016-06-17,12:30 p.m.,Mark Nichols,"Need some data support for stories that involve the water we drink and public systems that supply water? Look no further than the EPA's Safe Drinking Water Information System (SDWIS). USA TODAY's Mark Nichols gives you a guided tour of the website that houses data for more than 155,000 public water systems across the U.S. and its territories, and shows you strengths and weaknesses of SDWIS data, based on personal experiences.
",Salon A,http://ire.org/events-and-training/event/2199/2633/
,Investigations with DocumentCloud,2016-06-17,11:30 a.m.,2016-06-17,12:30 p.m.,"Ted Han, Justin Reese, Lauren Grandestaff","Get a hands-on tour of DocumentCloud and how to make the most of its search, annotation, collaboration and publishing tools for your next investigation. Plus, we'll offer up great examples of DocumentCloud in action in recent investigative reports and newsroom tools.
",Salon C,http://ire.org/events-and-training/event/2199/2695/
,Show & Tell *Friday - #3 (Sponsored by Napoli Management Group),2016-06-17,11:30 a.m.,2016-06-17,12:30 p.m.,Steven Ackermann,"**Moderated by Steven Ackermann, Raycom Media
Show & Tell sessions allow you to share your investigations with colleagues from around the country. Veteran broadcasters will moderate each session. Each slot runs for 10 minutes and includes a 5-minute break.
Reserve a slot online: Friday sign-ups open at 9 a.m. on Thursday.
",Galerie 2,http://ire.org/events-and-training/event/2199/2720/
,Political advertising: How to unlock new insights from a fresh treasure trove of data,2016-06-17,11:30 a.m.,2016-06-17,12:30 p.m.,"Nancy Watzman, Aaron Sharockman, Robert Maguire","In an increasingly chaotic and fractious political season that promises to offer the largest volume of ads ever seen in US history, the new Political TV Ad Archive — powered by the Internet Archive— is preserving ads online and making underlying metadata on airings, sponsors, and more available to journalists. Come hear from the Internet Archive, along with journalism and fact-checking partners who are using the data in novel ways, to find out how to make the most of this resource. The project is funded via the Knight News Challenge.
",Galerie 6,http://ire.org/events-and-training/event/2199/2577/
,Broadcast: How to get people to talk,2016-06-17,11:30 a.m.,2016-06-17,12:30 p.m.,"Cindy Galli, Dina Gusovsky, Scott Zamost","It sounds impossible -- key subjects in your story won't go on camera. But there are proven techniques to change their mind. From scammers to sex offenders, two network producers and a correspondent share what works to land sit-down interviews with the people least likely to talk.
",Galerie 3,http://ire.org/events-and-training/event/2199/2582/
,Lunch on your own (Friday),2016-06-17,12:30 p.m.,2016-06-17,2:30 p.m.,TBA,,See printed schedule for room information,http://ire.org/events-and-training/event/2199/2750/
,Media lawyers brown bag,2016-06-17,12:45 p.m.,2016-06-17,2:15 p.m.,TBA,"Does your investigation contain complex legal questions? Unsure of how to proceed? During the media lawyers brown bag, between 12:45 and 2 p.m. on Friday, June 17, bring your lunch and your questions for a personal discussion with some prominent media law experts that will be presenting throughout the 2016 IRE Conference. We'll provide drinks and dessert.
",Galerie 6,http://ire.org/events-and-training/event/2199/2733/
