Topic,Subject,Start Date,Start Time,End Date,End Time,Speaker(s),Description,Location,URL
tableau,Finding and telling data stories with Tableau Public (Hosted by Tableau) *pre-registered attendees only,2016-06-16,1:30 p.m.,2016-06-16,3:00 p.m.,Ben Jones,"Got a dataset and an impending deadline to write a story on it? Find the scoop and convey it with beautiful, interactive visualizations in a serial narrative using Tableau Public. It's a fast, easy to use, and free tool for journalists. Visualizations will publish using any CMS and no programming is required. 
We'll teach you how to:
•Connect to Excel files and other file types•Rapidly explore and analyze datasets with ease•Make eye-catching visualizations to share your findings•Add interactivity and arrange them in a serial narrative to engage and sustain your audience's attention
No previous experience with Tableau is necessary to attend. Laptops will be provided. This is a free training, however you must be registered for the IRE Conference to attend this class. Limited seats are available. There may be a few seats available on-site.
Register for this class
",Salon C,http://ire.org/events-and-training/event/2199/2698/
,IRE Board Meeting,2016-06-16,2:00 p.m.,2016-06-16,6:00 p.m.,TBA,"The IRE Board of Directors will meet at 2 p.m. Thursday in New Orleans as part of the annual conference.  The meeting is open to all IRE members.
",Riverview I,http://ire.org/events-and-training/event/2199/2619/
,Broadcast showcase: The changing network landscape,2016-06-16,2:30 p.m.,2016-06-16,3:30 p.m.,"Scott Zamost, Lea Thompson, Len Tepper,","**Moderated by Lea Thompson, formerly NBC News
They have all the big awards, they do the huge important stories, they are superstar producers at ABC, CBS and CNN. They're going to show you how they do it, how what they do has changed through the years and, yes, they'll give you insight on how you can get there too. Is there a difference between local and network television? How do network investigative units handle breaking news and the 24/7 news cycle? These producers know how to pick and drive stories and are masters at integrating on-air and on-web. They'll tell you how to stay out of trouble and share tips on how to keep delivering year after year.
",Galerie 3,http://ire.org/events-and-training/event/2199/2568/
,NICAR Commons: How to develop your own hyper personalized organizational system,2016-06-16,2:30 p.m.,2016-06-16,3:30 p.m.,Jesse Patel,"**Moderated by Jesse Patel, WorkFlowy
In this session, Jesse Patel will work with people one-on-one to create a custom set up in WorkFlowy, the powerful organizational tool he helps develop. He will show you how to create an organizational system perfectly tailored to your way of working and thinking. He'll go through as many people as he can in the time allotted, with everyone watching and contributing ideas. Jesse is happy to keep working with people after the time expires if there isn't enough time to work with everyone who attends.
",Preservation Hall,http://ire.org/events-and-training/event/2199/2620/
spreadsheets,Getting data into Excel,2016-06-16,2:30 p.m.,2016-06-16,3:30 p.m.,Rui Kaneya,"Don't let hard-to-use data ruin your day. Learn how to import a variety of formats (such as text files, HTML tables, PDFs) into Excel.
Prerequisites: None.
",Salon B,http://ire.org/events-and-training/event/2199/2642/
,Broadcast deep dives 1 (Sponsored by Napoli Management Group),2016-06-16,2:30 p.m.,2016-06-16,3:30 p.m.,"Andy Pierrotti, Steve Eckert, Eva Parks, A. J. Lagoe, Scott Friedman","Hear five award-winning investigative journalists explain how they produced big projects for broadcast and online. Journalists will show their investigations and then take you step by step, from story tip to a finished product.
",Galerie 2,http://ire.org/events-and-training/event/2199/2575/
,"Investigating realities: Approaches to  reporting, production, and development with VR",2016-06-16,2:30 p.m.,2016-06-16,3:30 p.m.,"Lakshmi Sarah, Robert Hernandez, Trey Bundy, Stephan Gensch","**Moderated by Robert Hernandez, University of Southern California - Annenberg
As 360° video and VR settles into being an essential platform for journalism, a number of critical questions emerge to challenge reporters and newsrooms. Especially when the promise of deeper empathy collides with the risks of voyeurism as audiences explore subjects and sources in ways never contemplated by the 2D Web. This session will explore the technical and editorial opportunities and implications of the technology. Panelists include reporters, technologists and designers working at the front edge of this important new space.
",Salon F-H,http://ire.org/events-and-training/event/2199/2727/
,Investigating supply chains (Sponsored by Knight Foundation),2016-06-16,2:30 p.m.,2016-06-16,3:30 p.m.,"Richard Marosi,","Coffee, cocoa, sneakers and shrimp: Where are these coming from and who are the laborers producing, processing and making them? As global trade makes it cheaper and faster to outsource labor, it's more important than ever for journalists to hold corporations accountable for the social, environmental and health impacts of their products. This means tracking consumer goods back to their source with specific, accurate detail. During this session we're talking supply chain tracking methodology, from staking out factories and following trucks, to satellite photos, document dives and other resources to help journalists follow the goods.
",Galerie 1,http://ire.org/events-and-training/event/2199/2689/
,The fight for (information) freedom (Sponsored by Press Club of New Orleans),2016-06-16,2:30 p.m.,2016-06-16,3:30 p.m.,"Lee Zurik, Karen Gadbois, Katie Moore, Robert McClendon, Scott Sternberg","An examination of how to survive and thrive in the age of the Freedom of Information Act and other access laws. A panel of award-winning journalists and experts will discuss best practices, tips and strategies that have helped in navigating FOIA, and the challenges and barriers while working to access and collect data, records and other information made available to the public under the law.
",Galerie 4-5,http://ire.org/events-and-training/event/2199/2565/
,Investigating inequality,2016-06-16,2:30 p.m.,2016-06-16,3:30 p.m.,"Nikole Hannah-Jones, Kristal Brent Zook",,Salon D,http://ire.org/events-and-training/event/2199/2552/
,Educators: Lightning talks,2016-06-16,2:30 p.m.,2016-06-16,3:30 p.m.,Brant Houston,"**Moderated by Brant Houston, University of Illinois
What works best when teaching college-level investigative reporting or data journalism courses? Find out in this session featuring a series of 5-minute lightning talks dedicated to teaching students how to use documents and data in journalism. Instructors will highlight successful approaches, best teaching techniques, data for students, and more. The following speakers have been selected to present:
Dianne Finch, Elon University
Dee J. Hall, Wisconsin Center for Investigative Journalism
Lorie Hearn, inewsource
David Herzog, IRE/NICAR
Brant Houston, University of Illinois
Courtney Mabeus, The Virginian-Pilot
Deborah Nelson, University of Maryland
Brian O'Donoghue, University of Alaska Fairbanks
Cheryl Phillips, Stanford University
",Studio 9-10,http://ire.org/events-and-training/event/2199/2547/
,50 apps in 30 minutes (+ 30 minutes of other cool stuff),2016-06-16,2:30 p.m.,2016-06-16,3:30 p.m.,David Ho,"Supercharge your smartphone for reporting! The Wall Street Journal's Executive Mobile Editor David Ho will help you turn your phone into a Swiss Army Knife of journalism goodness with this always-updating and fun session on apps and tools for gathering and producing news. Want to use your phone to record interviews? Take better notes? Transcribe audio? Edit video? Track tweets? Talk on camera? ID airplanes? Translate Swahili? There's an app for that. Plus, learn about more tips, tricks and mobile gear.
",Salon E,http://ire.org/events-and-training/event/2199/2558/
tableau,Designing Tableau visualizations for mobile (Hosted by Tableau) *pre-registered attendees only,2016-06-16,3:45 p.m.,2016-06-16,5:15 p.m.,Dash Davidson,"Are mobile readers of your news site becoming more and more common? If your news organization is like others we've worked with, the percent of readers using phones and tablets to read your content is well over half of the overall number, and growing fast. Creating data visualizations for these small form-factors is very challenging. Learn how to use Tableau to create sheets and dashboards that work great, even on phones and tablets. 
•Design considerations, including layout and formatting•Dashboard sizing for a range of screen widths•Interactivity – filtering and tooltips•Options to embed visualizations to respond to reader device
Some experience with Tableau Public is recommended. Taking one of the earlier Tableau sessions should suffice. Laptops will be provided. This is a free training, however you must be registered for the IRE Conference to attend this class. Limited seats are available. There may be a few seats available on-site.
Register for this class
",Salon C,http://ire.org/events-and-training/event/2199/2699/
spreadsheets,Cleaning data with OpenRefine,2016-06-16,3:45 p.m.,2016-06-16,4:45 p.m.,"Robert Gebeloff, Nils Mulvad","OpenRefine is a good tool to clean really dirty data -- the kind of data in which the same name might be spelled in 30 different ways. It has built-in cleaning tools for analysts and journalists.
This session will be most useful if: You have some experience working with data in columns and rows, in spreadsheets or database managers.
",Salon B,http://ire.org/events-and-training/event/2199/2653/
,Campus coverage: The cost of going to college,2016-06-16,3:45 p.m.,2016-06-16,4:45 p.m.,"Gordon Russell, Jon Marcus, Alex Richards","**Moderated by Alex Richards, IRE/NICAR
The cost of going to college is somewhat of a shell game. Even with discounts and financial aid, low-income students often end up paying more. Administrative costs have skyrocketed with luxury posts. Our panelists will show you how to use data and shoe-leather reporting to dig into the divide between the rich and the poor, how to challenge conventional wisdom and show the fallout of higher ed policies.
",Galerie 4-5,http://ire.org/events-and-training/event/2199/2681/
,The business of freelancing: Securing grants (Sponsored by the Fund for Investigative Journalism and FIRE),2016-06-16,3:45 p.m.,2016-06-16,4:45 p.m.,"Laird Townsend, Brant Houston, Esther Kaplan, Jane Sasseen, Ricardo Sandoval-Palos, Stephen Sapienza"," **Moderated by Brant Houston, University of Illinois
Leaders from organizations that give grants to freelancers will explain what kinds of stories they are looking for and what you need to do to successfully apply for a grant. This will be a robust question and answer session.
",Salon E,http://ire.org/events-and-training/event/2199/2549/
,Broadcast: Investigating your local school system,2016-06-16,3:45 p.m.,2016-06-16,4:45 p.m.,"Eric Flack, Jenna Susko, Kelly Hinchcliffe","Public school systems can be the single biggest bureaucratic entity outside of state government, in some places, even bigger. What are the richest opportunities for journalists to expose waste, abuse and misuse of taxpayer dollars? This wide ranging panel will dig deep for impactful reporting on public schools.
",Galerie 3,http://ire.org/events-and-training/event/2199/2569/
statistics,Understanding crime and justice statistics -- new challenges and a new guide from IRE (Sponsored by Criminal Justice Journalists),2016-06-16,3:45 p.m.,2016-06-16,4:45 p.m.,"Daniel Lathrop, Jodi Upton, Ted Gest, Ben Poston","**Moderated by Ted Gest, Criminal Justice Journalists
The widespread interest in shootings by police and mass murders, and the unexpected increase in homicides in many major cities, has focused attention on the major gaps in crime and justice data available in the U.S. In this session, as IRE and Criminal Justice Journalists have just updated the guide for reporters, we'll talk about how to get and interpret the latest government and private-sector reports.
",Studio 9-10,http://ire.org/events-and-training/event/2199/2548/
,Outlook potentially negative: When PIOs fight back,2016-06-16,3:45 p.m.,2016-06-16,4:45 p.m.,"Jack Gillum, John Kelly, Maud Beelman, Michael Morisy","**Moderated by Maud Beelman, The Associated Press
This session will offer great tips for working with or working around public information officers, especially when they become roadblocks to your investigation or seek to discredit your reporting. The panelists will also offer strategies for successful open records requests, which increasingly are passing through the press department rather than an agency's FOIA office.
",Salon D,http://ire.org/events-and-training/event/2199/2553/
,5 hacks to get started in data or tech (Sponsored by Knight Foundation),2016-06-16,3:45 p.m.,2016-06-16,4:45 p.m.,Samantha Sunne,"Everyone needs to know data these days. You're definitely gonna get right on it… as soon you've finished this story, and covered the city council meeting, and learned to write Python - whatever that is. Or, you could put off Python a while longer, and use these five hacks to work data in the reporting you're already doing.
",Galerie 1,http://ire.org/events-and-training/event/2199/2573/
,Management: Just say no (or yes) - Vetting story ideas,2016-06-16,3:45 p.m.,2016-06-16,4:45 p.m.,"Amy Pyle, Jennifer Forsyth, Flynn McRoberts","Panelists will provide advice on how to deploy scarce resources toward the most impactful and memorable investigations. Topics will include how to assess if a journalist can deliver on an idea; strategies for converting weak proposals into powerful ones and solid enterprise ideas into investigations; and how to manage disappointment when an idea falls short or must be sidelined for something more urgent. Panelists also will suggest ways to avoid common mistakes that journalists make in conceiving and executing investigations.
",Salon F-H,http://ire.org/events-and-training/event/2199/2676/
,NICAR Commons: Investigating realities: A VR discussion,2016-06-16,3:45 p.m.,2016-06-16,4:45 p.m.,TBA,,Preservation Hall,http://ire.org/events-and-training/event/2199/2782/
,Show & Tell *Thursday - #4 (Sponsored by Napoli Management Group),2016-06-16,3:45 p.m.,2016-06-16,4:45 p.m.,Keith Esparros,"**Moderated by Keith Esparros, CBS - WWL/New Orleans
Show & Tell sessions allow you to share your investigations with colleagues from around the country. Veteran broadcasters will moderate each session. Each slot runs for 10 minutes and includes a 5-minute break.
Reserve a slot online: Thursday sign-ups open at 9 a.m. on Wednesday.
",Galerie 2,http://ire.org/events-and-training/event/2199/2716/
,#Black(media)matters (Sponsored by The Louisiana Weekly),2016-06-16,5:00 p.m.,2016-06-16,6:00 p.m.,"Renette Dejoie-Hall, Anthony Advincula, Jinx Broussard, Kristal Brent Zook, David Baker","**Moderated by Renette Dejoie-Hall, The Louisiana Weekly
Black Media Matters is a one-hour moderated discussion on the state of Black media, the unique space occupied by Black media, and other hyper-local media outlets whose coverage focuses primarily on issues of social, economic and environmental equality, equity and justice. From Selma in 1965 to #BlackLivesMatter, from Hill v. Thomas to Roe v. Wade, and from Hurricane Katrina to the BP oil spill, this discussion will focus on reporting the issues affecting marginalized communities from the inside out.
Panelists will discuss their experiences in taking national and global issues and reporting on those topics from the perspective of some of the nation's most marginalized communities -- exploring the techniques, strategies and methods journalists have used to navigate and report on the often divisive subjects of age, ethnicity, gender, nationality, race, religion, and sexuality to produce news content that offers a diversity of views, and are compelling, fact-based and fair.
",Studio 9-10,http://ire.org/events-and-training/event/2199/2760/
,Humanizing numbers,2016-06-16,5:00 p.m.,2016-06-16,6:00 p.m.,"Mc Nelly Torres, Andrew Lehren, Kendall Taggart","Data helps you tell your story, yet for journalists, the most important work remains the human story and giving insight into individuals. Come to this session to see how data journalists help their readers empathize and how they balance analysis with narrative. Panelists will share how they write effectively about statistics, use data to find real people to interview, and develop data visualizations that bring numbers to life. We will show great examples that we admire and we'll share concrete tips from our own work.
",Salon F-H,http://ire.org/events-and-training/event/2199/2562/
,Investigating in the wake of disaster (Sponsored by Dart Center for Journalism & Trauma),2016-06-16,5:00 p.m.,2016-06-16,6:00 p.m.,"Bruce Shapiro, Jason Berry, Justin Elliott, Laura Sullivan, Rick Young, Irwin Redlener","**Moderated by Bruce Shapiro, Dart Center for Journalism & Trauma
",Galerie 3,http://ire.org/events-and-training/event/2199/2677/
,Covering 21st century policing in the social media ageâ (Sponsored by Criminal Justice Journalists)â,2016-06-16,5:00 p.m.,2016-06-16,6:00 p.m.,"Kimberly Kindy, Ted Gest, Brad Schrade, Ronal Serpas","**Moderated by Ted Gest, Criminal Justice Journalists
Are today's police officers in the U.S. more abusive than they used to be, or is it just that a few bad apples are being readily exposed by ubiquitous video cameras? How should journalists be covering developments in policing, including changes in training and investigations of drugs and other crime problems? Journalists who cover these issues will be joined by a veteran police official who argues that law enforcement can reduce both crime and incarceration.
",Salon D,http://ire.org/events-and-training/event/2199/2554/
,Automate and turbocharge your social media (Sponsored by Knight Foundation),2016-06-16,5:00 p.m.,2016-06-16,6:00 p.m.,Doug Haddix,"Learn how to curate social media content with tools such as Dlvr.it, Feedly and Scoop.It. See how to combine those tools with Buffer to automatically post updates on Twitter, Facebook, LinkedIn and other platforms. Discover how to create recipes with the free If This, Then That (IFTTT) service to track hashtags or key phrases on social channels and download results automatically. Monitor tweets from a specific place (e.g. the statehouse) and download them automatically to a spreadsheet. And much, more more. No programming skills needed.
",Galerie 1,http://ire.org/events-and-training/event/2199/2574/
,Unleash the data: Tools and tricks for taming PDFs,2016-06-16,5:00 p.m.,2016-06-16,6:00 p.m.,"Nils Mulvad, Jaimi Dowdell","This class will cover basic approaches for getting text out of PDF documents using powerful and freely available tools. Participants will be introduced to basic concepts and walked-through tackling common challenges encountered with tricky PDF documents.
This class is best for: People who are unfamiliar with the PDF to text tools or would like to learn how optical character recognition (OCR) tools can be used for extracting difficult text from images embedded in PDF documents.
",Salon B,http://ire.org/events-and-training/event/2199/2644/
,Campaign 2016: Backgrounding candidates and measuring effectiveness (Sponsored by Rockefeller Brothers Fund),2016-06-16,5:00 p.m.,2016-06-16,6:00 p.m.,"Steve Eder, James Grimaldi, Jonathan Salant, Kathy Kiely","**Moderated by Kathy Kiely, BillMoyers.com
Candidates for public office have more funds than ever for spin machines, just as most newsrooms have less money than ever for reporting resources. Don't despair! A panel of veteran money-in-politics reporters will offer tricks and tips for getting past political hopefuls' press releases and determining whose interests the candidates have been serving or are likely to serve. Whether the contest you're covering is for president of the United States or president of the school board, these pointers should help you hold power accountable — and help your readers cast more informed votes.
",Galerie 4-5,http://ire.org/events-and-training/event/2199/2682/
,Show & Tell *Thursday - #5 (Sponsored by Napoli Management Group),2016-06-16,5:00 p.m.,2016-06-16,6:00 p.m.,Dave Savini,"****Moderated by Dave Savini, CBS/WBBM Chicago
Show & Tell sessions allow you to share your investigations with colleagues from around the country. Veteran broadcasters will moderate each session. Each slot runs for 10 minutes and includes a 5-minute break.
Reserve a slot online: Thursday sign-ups open at 9 a.m. on Wednesday.
",Galerie 2,http://ire.org/events-and-training/event/2199/2717/
,NICAR Commons: What to do about talented but troublesome reporters,2016-06-16,5:00 p.m.,2016-06-16,6:00 p.m.,Jennifer Forsyth,"**Moderated by Jennifer Forsyth, The Wall Street Journal
Editors and managers will get together to share notes and compare tips on dealing with investigative journalists who have tremendous skills but who also present management challenges. These types include those who alienate their sources or colleagues, who are overzealous in their conclusions, who refuse to embrace 21st century media or who fight every proposed edit to their work.
",Preservation Hall,http://ire.org/events-and-training/event/2199/2774/
,Failures of enforcement,2016-06-16,5:00 p.m.,2016-06-16,6:00 p.m.,"Howard Berkes, Jeremy Schwartz, David Heath, Ziva Branstetter","**Moderated by Ziva Branstetter, The Frontier
Panelists will discuss how government agencies have the authority, means and responsibility to regulate and enforce, but often lack the will. Discussion will include, how to use agency data to write about the human toll this culture of inaction takes and the impact it has on subjects as diverse as mine workers, migrant laborers and abused children. This panel will also focus on how to sift through the records and data to find good human examples and bring the story alive. 
",Salon E,http://ire.org/events-and-training/event/2199/2701/
tableau,A sneak peek at Tableau Public 10.0: Fast and easy mobile-friendly data vizzes (Hosted by Tableau),2016-06-16,5:30 p.m.,2016-06-16,6:00 p.m.,Daniel Hom,,Salon C,http://ire.org/events-and-training/event/2199/2765/
,Welcome reception,2016-06-16,7:00 p.m.,2016-06-16,8:30 p.m.,TBA,"Sponsored by The Advocate
Kick off the conference with a welcome reception Thursday night at the Audubon Aquarium of the Americas (1 Canal St, New Orleans, LA 70130), beginning at 7 p.m.
Meet up with friends you have not seen since last year and welcome new attendees. Light hors d' oeuvres will be served and each attendee will receive one drink ticket.
",See printed schedule for room information,http://ire.org/events-and-training/event/2199/2740/
,IRE Sales Table (Friday),2016-06-17,7:30 a.m.,2016-06-17,6:15 p.m.,TBA,"Stop by the IRE sales table and take a look at our merchandise. We will be selling books, the large selection of titles we carry will certainly include your interests. All proceeds from your purchase help support IRE and its mission.  Sales will be located in Preservation Hall on the 2nd floor of the New Orleans Marriott.
",Preservation Hall,http://ire.org/events-and-training/event/2199/2746/
,IRE Conference Registration (Friday),2016-06-17,7:30 a.m.,2016-06-17,6:15 p.m.,TBA,,"Preservation Booth, 2nd floor",http://ire.org/events-and-training/event/2199/2743/
,Show & Tell *Friday - #1 (Sponsored by Napoli Management Group),2016-06-17,9:00 a.m.,2016-06-17,10:00 a.m.,Ramon Escobar,"**Moderated by Ramon Escobar, CNN
Show & Tell sessions allow you to share your investigations with colleagues from around the country. Veteran broadcasters will moderate each session. Each slot runs for 10 minutes and includes a 5-minute break.
Reserve a slot online: Friday sign-ups open at 9 a.m. on Thursday.
",Galerie 2,http://ire.org/events-and-training/event/2199/2718/
,Campaign 2016: Following the (dark) money (Sponsored by Rockefeller Brothers Fund),2016-06-17,9:00 a.m.,2016-06-17,10:00 a.m.,"Robert Maguire, Fredreka Schouten, Michael Beckel, Russ Choma","**Moderated by Michael Beckel, The Center for Public Integrity
The 2016 election is expected to be the most expensive in history, and big-money political animals that don't disclose their funders are taking on new roles. Come learn about this proliferation of political ""dark money"" and a variety of backdoor ways you might be able to discern who's behind these opaque political spenders. Get ready to dig into IRS reports, Federal Election Commission data, Department of Labor filings and corporate disclosures — as well as pound the pavement — to get answers.
",Galerie 4-5,http://ire.org/events-and-training/event/2199/2602/
